動詞,どうし,verb,JLPT JLPT_2 JLPT_3,Jt^|GpM7=V,"กริยา, คำกริยา, การกระทำ, การเคลื่อนไหว",「走る」は動詞です。,'วิ่ง' เป็นคำกริยา
同時,どうじ,"simultaneous(ly), same time",JLPT JLPT_2 JLPT_3,yvg^A$k^a|,"พร้อมกัน, ในเวลาเดียวกัน, พร้อมเพรียง, ในคราวเดียวกัน",二人は同時に来ました。,ทั้งสองคนมาถึงพร้อมกัน
どうしても,どうしても,"at any cost, no matter what, no matter how hard one tries",JLPT Intermediate_Japanese JLPT_3 JLPT_2 Intermediate_Japanese_Ln.11,u>t|EJmDdT,"ไม่ว่าจะด้วยวิธีใดก็ตาม ไม่ว่าจะต้องแลกด้วยอะไร ไม่ว่าจะพยายามมากแค่ไหนก็ตาม, ยังไงก็ต้อง, ต้องให้ได้, อย่างไรก็ตาม",どうしても行きたいです。,ฉันอยากไปให้ได้ไม่ว่าจะด้วยวิธีใดก็ตาม
どうぞよろしく,どうぞよろしく,pleased to meet you,JLPT JLPT_2 JLPT_3,k:&n.w>9]!,"ยินดีที่ได้พบคุณ, ยินดีที่ได้รู้จัก, ดีใจที่ได้พบ, ยินดีมาก",どうぞよろしく。,ยินดีที่ได้รู้จัก
到着,とうちゃく,arrival,JLPT JLPT_2 JLPT_3,i)aR;Wlc03,"การมาถึง, มาถึง, การปรากฏตัว, การเข้ามา",電車が到着しました。,รถไฟมาถึงแล้ว
道徳,どうとく,morals,JLPT JLPT_2 JLPT_3,F<|nkQy)11,"คุณธรรม, ศีลธรรม, จริยธรรม, คุณงามความดี",道徳は大切です。,คุณธรรมเป็นสิ่งสำคัญ
投票,とうひょう,"voting, poll",JLPT JLPT_2 JLPT_3,NlT[;z*wrK,"การลงคะแนน, โพลล์, ลงคะแนนเสียง, สำรวจความคิดเห็น",投票に行きました。,ฉันไปลงคะแนนเสียง
東洋,とうよう,Orient,JLPT JLPT_2 JLPT_3,kzZ}UECtrI,"ตะวันออก, ทิศตะวันออก, ภาคตะวันออก, ทางตะวันออก",これは東洋の絵です。,นี่คือภาพวาดตะวันออก
同様,どうよう,"identical, same (kind), like",JLPT JLPT_2 JLPT_3,w[nqm0x.)$,"เหมือนกัน, ชนิดเดียวกัน, คล้ายกัน",これとそれは同様です。,อันนี้กับอันนั้นเหมือนกัน
童謡,どうよう,"children's song, nursery rhyme",JLPT JLPT_2 JLPT_3,pW$[md&UnE,"เพลงสำหรับเด็ก, บทกลอนกล่อมเด็ก, เพลงเด็ก, เพลงกล่อมเด็ก",子供がおとぎ話を聞いています。,เด็กๆ กำลังฟังเพลงเด็ก
同僚,どうりょう,colleague; co-worker,JLPT Intermediate_Japanese JLPT_3 JLPT_2 Intermediate_Japanese_Ln.6 Genki Genki_Ln.21,Ra.t5JBS3r,"เพื่อนร่วมงาน; ผู้ร่วมงาน, ผู้ร่วมงาน, ผู้ร่วมอาชีพ, สหายร่วมงาน",彼は私の同僚です。,เขาเป็นเพื่อนร่วมงานของฉัน
道路,どうろ,road,JLPT JLPT_2 JLPT_3,zy.8&725kR,"ถนน, ทาง, เส้นทาง, หนทาง",この道路は広いです。,ถนนเส้นนี้กว้าง
通す,とおす,"to let pass, to overlook, to continue",JLPT JLPT_2 JLPT_3,iHbDjUw`ah,"ปล่อยผ่านไป มองข้าม ดำเนินต่อไป, ผ่าน, ปล่อยไป, เพิกเฉย",風が窓を通り抜けました。,ลมพัดผ่านหน้าต่าง
通り過ぎる,とおりすぎる,"to pass, to pass through",JLPT JLPT_2 JLPT_3,n%iou*]&!6,"ผ่านไป, ผ่านไปได้, เลยไป, ล่วงผ่าน",バスが通り過ぎました。,รถบัสแล่นผ่านไป
都会,とかい,city,JLPT JLPT_2 JLPT_3,p*_|WF)kYy,"เมือง, นคร, ชุมชนเมือง, เขตเมือง",東京は大きな都会です。,โตเกียวเป็นเมืองใหญ่
溶く,とく,to dissolve (paint),JLPT JLPT_2 JLPT_3,M1t!(0fZzF,"เพื่อละลาย (สี), เจือจาง, ผสม, ทำให้ละลาย",絵の具を溶きます。,ฉันกำลังผสมสี
解く,とく,"to unfasten; answer, solve",JLPT JLPT_2 JLPT_3,b.j;M[.:j7,"คลายออก; ตอบ, แก้ไข, แก้, ปลด",問題を解きます。,ฉันแก้ปัญหา
退く,どく,"to retreat, to recede, to withdraw",JLPT JLPT_2 JLPT_3,c$$~C+pfb},"ถอยกลับ, ถอยห่าง, ถอนตัว, ถอยร่น",敵が退きました。,ศัตรูถอยทัพ
毒,どく,"poison, toxicant",JLPT JLPT_2 JLPT_3,DARItH3te],"สารพิษ, ยาพิษ, พิษร้าย",これは毒です。,นี่คือยาพิษ
得意,とくい,"pride, triumph, prosperity",JLPT JLPT_2 JLPT_3,w<S{;~)l0:,"ความภาคภูมิใจ ชัยชนะ ความเจริญรุ่งเรือง, ภูมิใจ, ชัย, รุ่งเรือง",数学は得意です。,ฉันเก่งคณิตศาสตร์
読書,どくしょ,reading,JLPT JLPT_2 JLPT_3,F6~L<UDvE+,"การอ่าน, อ่านหนังสือ, การศึกษา, การอ่านออก",読書は楽しいです。,การอ่านหนังสือเป็นเรื่องสนุก
独身,どくしん,"single, unmarried",JLPT Intermediate_Japanese JLPT_3 JLPT_2 Intermediate_Japanese_Ln.14,img~a/~?x<,"โสด ยังไม่แต่งงาน, เป็นโสด, คนโสด, ไม่มีคู่",彼は独身です。,เขาเป็นโสด
特徴,とくちょう,characteristic(s); feature(s); trait(s),JLPT Intermediate_Japanese JLPT_3 JLPT_2 Intermediate_Japanese_Ln.10,dd#*-FyzHW,"ลักษณะเฉพาะ; คุณสมบัติ; คุณลักษณะ, คุณสมบัติพิเศษ, จุดเด่น, ลักษณะพิเศษ",この猫は特徴があります。,แมวตัวนี้มีลักษณะพิเศษ
特長,とくちょう,"forte, merit",JLPT JLPT_2 JLPT_3,e_t7Cd~09D,"จุดแข็ง, คุณสมบัติ, ข้อดี, ความสามารถพิเศษ",この車の特長は何ですか。,คุณสมบัติพิเศษของรถคันนี้คืออะไร
独特,どくとく,"peculiarity, uniqueness, characteristic",JLPT JLPT_2 JLPT_3,"hWn,<pPOA","ความแปลกประหลาด ความเป็นเอกลักษณ์ ลักษณะเฉพาะ, เอกลักษณ์, ไม่เหมือนใคร, ความพิเศษ",彼の話し方は独特です。,วิธีพูดของเขามีเอกลักษณ์เฉพาะตัว
独立,どくりつ,"independence (e.g., Ind. Day), self-support",JLPT JLPT_2 JLPT_3,wgVbY)l!G:,"ความเป็นอิสระ (เช่น วันประกาศอิสรภาพ) การพึ่งพาตนเอง, อิสรภาพ, เสรีภาพ, เป็นตัวของตัวเอง",これは独立した国です。,นี่คือประเทศที่เป็นอิสระ
溶ける,とける,"to melt, to thaw, to dissolve",JLPT JLPT_2 JLPT_3,Go3eNt+^C%,"ละลาย, ละลายน้ำแข็ง, สลายตัว, หลอมละลาย",氷が溶けました。,น้ำแข็งละลายแล้ว
解ける,とける,"to come untied, to come apart",JLPT JLPT_2 JLPT_3,E_4w+LM=cF,"หลุดออกจากกัน, แยกออกจากกัน, แก้ปม, คลายออก",靴の紐が解けました。,เชือกรองเท้าหลุด
どこか,どこか,"somewhere, anywhere",JLPT JLPT_2 JLPT_3,n<7QA|Q%GZ,"ที่ไหนสักแห่ง ที่ไหนก็ได้, บางที่, ที่ใดที่หนึ่ง, ณ ที่ใด",どこかへ行きたいです。,ฉันอยากไปที่ไหนสักแห่ง
ところが,ところが,"however, while, even if",JLPT JLPT_2 JLPT_3,m-8$vGofT(,"อย่างไรก็ตาม แม้ว่าในขณะที่, แต่ทว่า, ถึงแม้ว่า, ในขณะเดียวกัน",雨が降りました。ところが、すぐに晴れました。,ฝนตก แต่แล้วก็แดดออกทันที
ところで,ところで,by the way; even if,JLPT Intermediate_Japanese JLPT_3 JLPT_2 Intermediate_Japanese_Ln.1,yzfKCn.aBb,"อย่างไรก็ตาม แม้ว่า, อย่างไรก็ดี, อนึ่ง, ถึงแม้",ところで、お名前は何ですか。,ว่าแต่ ชื่อของคุณคืออะไร
登山,とざん,mountain-climbing,JLPT JLPT_2 JLPT_3,N-%3i1PqFk,"การปีนเขา, ปีนภูเขา, เดินป่า, ขึ้นเขา",友達と登山をしました。,ฉันไปปีนเขา กับเพื่อน
都市,とし,"town, city, urban",JLPT JLPT_2 JLPT_3,tNXI!+#v:`,"เมือง, นคร, เขตเมือง, ตัวเมือง",大阪は大きな都市です。,โอซาก้าเป็นเมืองใหญ่
年月,としつき,months and years,JLPT JLPT_2 JLPT_3,b%`/I;RJ$^,"เดือนและปี, ระยะเวลา, ตลอดปี, กาลเวลา",年月が経ちました。,เวลาผ่านไปหลายปี
図書,としょ,books,JLPT JLPT_2 JLPT_3,e>Nm^AgJ]),"หนังสือ, ตำรา, พ็อกเก็ตบุ๊ก, วรรณกรรม",図書館で図書を借りました。,ฉันยืมหนังสือจากห้องสมุด
年寄,としより,"old people, the aged",JLPT JLPT_2 JLPT_3,dH(n+sRgp{,"คนแก่, ผู้สูงวัย, ผู้สูงอายุ, คนชรา",年寄りに席を譲りました。,ฉันลุกให้ที่นั่งแก่ผู้สูงอายุ
閉じる,とじる,"to close (e.g., book, eyes), to shut",JLPT JLPT_2 JLPT_3,JWs?hJ:*yD,"ปิด (เช่น หนังสือ, ตา), ปิด, หุบ",本を閉じました。,ฉันปิดหนังสือ
途端,とたん,"just (now, at the moment, etc.)",JLPT JLPT_2 JLPT_3,hC>h/uXgyk,"เพิ่ง (ตอนนี้ ณ ขณะนี้ ฯลฯ), ทันทีที่, ทันใดนั้น, พลัน",ドアが開いた途端、猫が飛び出した。,ทันทีที่ประตูเปิด แมวก็วิ่งออกไป
土地,とち,"plot of land, lot, soil",JLPT JLPT_2 JLPT_3,d;>FkWx>zj,"ที่ดิน, แปลงที่ดิน, ดิน, พื้นดิน",この土地は広いです。,ที่ดินแปลงนี้กว้าง
突然,とつぜん,"abruptly, suddenly, unexpectedly",JLPT JLPT_2 JLPT_3,u9EG(SkQ{j,"อย่างกะทันหัน โดยไม่คาดคิด, ทันทีทันใด, ฉับพลัน, ไม่คาดฝัน",突然、雨が降ってきました。,จู่ๆ ฝนก็ตกพรำๆ
トップ,トップ,top,JLPT JLPT_2 JLPT_3,q]>Jr![.(N,"สูงสุด, อันดับแรก, ยอด, สุดยอด",彼はチームのトップです。,เขาเป็นอันดับหนึ่งของทีม
届く,とどく,to reach,JLPT JLPT_2 JLPT_3,e?<7!g}yZ;,"เพื่อไปถึง, ถึง, บรรลุ, เข้าถึง",荷物が届きました。,พัสดุมาถึงแล้ว
とにかく,とにかく,"anyhow, at any rate, anyway",JLPT JLPT_3 JLPT_2 Genki Genki_Ln.21,im{&K_@wV,"อย่างไรก็ตาม อย่างน้อยที่สุด ก็ยังไงก็ตาม, ไม่ว่าจะเกิดอะไรขึ้น, ไม่ว่าอย่างไรก็ตาม, ในกรณีใดๆ",とにかく、頑張ります。,ไม่ว่าจะเกิดอะไรขึ้น ฉันจะพยายาม
飛ばす,とばす,"to skip over, to omit",JLPT JLPT_2 JLPT_3,Hs}AOgVJU~,"ข้ามไป, ละเว้น, กระโดดข้าม, เว้นไป",このページを飛ばしてください。,โปรดข้ามหน้านี้ไป
飛び出す,とびだす,"to jump out, to rush out, to fly out",JLPT JLPT_2 JLPT_3,jD`AkcS%la,"กระโดดออกไป, รีบออกไป, บินออกไป, พุ่งออกไป",子供が家から飛び出しました。,เด็กวิ่งออกจากบ้าน
留める,とめる,"to fasten, to turn off, to detain",JLPT JLPT_2 JLPT_3,EluezN4]RV,"ยึดให้แน่น, ปิด, กักขัง, ตรึง",窓を留めてください。,โปรดปิดหน้าต่าง
泊める,とめる,to have someone stay (over night) (v.t.),JLPT Intermediate_Japanese JLPT_3 JLPT_2 Intermediate_Japanese_Ln.1,sr$3#;WnNi,"ให้ใครบางคนมาพักค้างคืน (กริยา), ให้พัก, ให้ค้าง, ให้ค้างคืน",友達を泊めました。,ฉันให้เพื่อนพักค้างคืน
友,とも,"friend, companion, pal",JLPT JLPT_2 JLPT_3,I(06/Hp@B7,"เพื่อน, สหาย, มิตร",彼は私の友です。,เขาเป็นเพื่อนของฉัน
共に,ともに,"sharing with, participate in",JLPT JLPT_2 JLPT_3,J&blXp45W[,"การแบ่งปันกับ การมีส่วนร่วม, ร่วมกัน, ด้วยกัน, มีส่วนร่วม",皆で共に頑張りましょう。,เรามาพยายามไปด้วยกันเถอะ
虎,とら,tiger,JLPT JLPT_2 JLPT_3,q3*!nq{_pc,"เสือ, พยัคฆ์, สัตว์ลายพาดกลอน, สัตว์ร้าย",動物園で虎を見ました。,ฉันเห็นเสือที่สวนสัตว์
ドライブ,ドライブ,"drive, driving",JLPT Genki_Ln.11 JLPT_3 JLPT_2 Genki,"I,~F.X8Z8F","ขับรถ, การขับรถ, ขับขี่, การขับขี่",週末にドライブをしました。,ฉันไปขับรถเล่นช่วงสุดสัปดาห์
トラック,トラック,truck; (running) track,JLPT JLPT_2 JLPT_3,q*_SbJJ@!!,"รถบรรทุก; ลู่วิ่ง, รถขนส่ง, รถกระบะ, สนามแข่ง",トラックが荷物を運んでいます。,รถบรรทุกกำลังขนส่งสินค้า
ドラマ,ドラマ,drama,JLPT JLPT_2 JLPT_3,mL~N]Bfwf},"ละคร, บทละคร, โศกนาฏกรรม, การแสดง",テレビでドラマを見ました。,ฉันดูละครทางทีวี
トランプ,トランプ,playing cards (lit: trump),JLPT JLPT_2 JLPT_3,m&n=U!*VAu,"ไพ่ (ไพ่เหนือกว่า), ไพ่, สำรับไพ่, เกมไพ่",トランプで遊びました。,ฉันเล่นไพ่
取り上げる,とりあげる,"to take up, to pick up; to confiscate",JLPT JLPT_2 JLPT_3,hUa->MmssI,"รับมา, หยิบขึ้นมา; ยึด, เก็บขึ้น, ยึดคืน",本を取り上げました。,ฉันหยิบหนังสือขึ้นมา
努力,どりょく,"great effort, exertion, endeavor",JLPT Intermediate_Japanese JLPT_3 JLPT_2 Intermediate_Japanese_Ln.14,P$}d5=b$SY,"ความพยายามอย่างมาก, ความมุ่งมั่น, การทุ่มเท, ความเพียร",彼は努力家です。,เขาเป็นคนขยัน
トレーニング,トレーニング,training,JLPT JLPT_2 JLPT_3,h-6r=v)@/P,"การฝึกอบรม, ฝึกฝน, การฝึกหัด, การเรียนรู้",ジムでトレーニングをしています。,ฉันกำลังออกกำลังกายที่ยิม
ドレス,ドレス,dress,JLPT JLPT_2 JLPT_3,wj.H_PUH[6,"ชุด, ชุดกระโปรง, เสื้อผ้า, เครื่องแต่งกาย",きれいなドレスを着ています。,เธอใส่ชุดสวย
取れる,とれる,"to come off, to be taken off",JLPT JLPT_2 JLPT_3,Hw{&qvpk7n,"ถอดออก, ถูกถอดออก, หลุด, หลุดร่วง",ボタンが取れました。,กระดุมหลุด
泥,どろ,mud,JLPT JLPT_2 JLPT_3,d(Q$9Oy/;r,"โคลน, ดินโคลน, เลน, ตม",道で泥に濡れました。,ฉันเปื้อนโคลนบนถนน
トン,トン,ton (1000 lbs.),JLPT JLPT_2 JLPT_3,c$BFN)`=lz,"ตัน (1, 000 ปอนด์), ตัน, หน่วยน้ำหนัก",この荷物は100トンです。,สินค้าชิ้นนี้หนัก 100 ตัน
とんでもない,とんでもない,"outrageous, No way!",JLPT JLPT_2 JLPT_3,bl*lVwAn^S,"เหลือเชื่อ! เป็นไปไม่ได้!, ไม่น่าเชื่อ, ไม่มีทาง, ไม่ใช่เรื่องจริง",とんでもない話です。,เป็นเรื่องเหลือเชื่อ
どんなに,どんなに,"how, how much",JLPT JLPT_2 JLPT_3,AecyZ~s0IY,"อย่างไร ราคาเท่าไหร่, อย่างไรบ้าง, แค่ไหน, มากเท่าไหร่",どんなに忙しくても、時間を作ります。,ไม่ว่าฉันจะยุ่งแค่ไหน ฉันก็จะหาเวลา
トンネル,トンネル,tunnel,JLPT JLPT_2 JLPT_3,"gyvzV/QL,O","อุโมงค์, ทางใต้ดิน, ช่องลอด, ทางลอด",トンネルを通り抜けました。,เราผ่านอุโมงค์ไป
名,な,"name, reputation",JLPT JLPT_2 JLPT_3,O0j|#CZ{DW,"ชื่อเสียง, เกียรติยศ, กิตติศัพท์, นาม",彼は名がある人です。,เขาเป็นคนมีชื่อเสียง
内容,ないよう,"subject, contents, detail",JLPT JLPT_2 JLPT_3,i{JT|O:vZ0,"หัวข้อ เนื้อหา รายละเอียด, ประเด็น, สาระสำคัญ, ข้อความ",この本の内容は面白いです。,เนื้อหาของหนังสือเล่มนี้สนุก
なお,なお,"still, yet",JLPT JLPT_2 JLPT_3,x$e]XDdzMn,"ยังคง แต่, ยัง, กระนั้น, ถึงกระนั้น",風邪が治りました。なお、熱も下がりました。,ฉันหายจากหวัดแล้ว นอกจากนี้ไข้ก็ลดลงด้วย
仲,なか,"relation, relationship",JLPT JLPT_2 JLPT_3,x6DIm?q|TP,"ความสัมพันธ์, สัมพันธภาพ, ความผูกพัน",彼とは仲がいいです。,ฉันกับเขาสนิทกัน
流す,ながす,"to drain, to float, to shed (e.g., blood, tears)",JLPT JLPT_2 JLPT_3,b9+3bd5x%g,"ไหลออก, ลอยขึ้น, ไหลออก (เช่น เลือด, น้ำตา)",川が流れています。,แม่น้ำกำลังไหล
半ば,なかば,"middle, halfway",JLPT JLPT_2 JLPT_3,m<2jyxDj3g,"ตรงกลาง, ครึ่งทาง, กลาง, กึ่งกลาง",会議は半ばです。,การประชุมอยู่ที่ครึ่งทาง
仲間,なかま,"company, fellow, colleague, associate",JLPT JLPT_2 JLPT_3,O~m#4j_48),"บริษัท, เพื่อนร่วมงาน, ผู้ร่วมอาชีพ, ผู้ร่วมงาน",彼は私の仲間です。,เขาเป็นเพื่อนร่วมงานของฉัน
中身,なかみ,content(s); substance,JLPT Intermediate_Japanese JLPT_3 JLPT_2 Intermediate_Japanese_Ln.13,J`BoSI)KdS,"เนื้อหา; สาร, สาระ, ใจความ, สิ่งที่อยู่ข้างใน",カバンのなかに何が入っていますか。,มีอะไรอยู่ในกระเป๋า
中味,なかみ,"contents, interior, filling",JLPT JLPT_2 JLPT_3,iXe{m_#VVd,"เนื้อหา, ภายใน, การบรรจุ, สาร",この箱の中味は何ですか。,ข้างในกล่องนี้มีอะไร
眺め,ながめ,scene; view; prospect; outlook,JLPT Intermediate_Japanese JLPT_3 JLPT_2 Intermediate_Japanese_Ln.10,q7BF&&<kDs,"ฉาก; มุมมอง; ทัศนียภาพ; อนาคต, วิว, ทิวทัศน์, ภาพทิวทัศน์",窓からの眺めが素晴らしいです。,วิวจากหน้าต่างสวยงามมาก
眺める,ながめる,"to view, to gaze at",JLPT JLPT_2 JLPT_3,Jux]l79hU7,"เพื่อดู เพื่อจ้องมอง, มอง, ดู, จ้อง",海を眺めます。,ฉันมองทะเล
流れ,ながれ,"stream, current",JLPT JLPT_2 JLPT_3,d.aR+yRU]C,"กระแส, การไหล, สายน้ำ",水の流れが速いです。,กระแสน้ำไหลเร็ว
流れる,ながれる,"to flow, to be washed away",JLPT JLPT_2 JLPT_3,L(]6kjxkO5,"ไหล, ถูกชะล้างไป, ไหลไป, พัดพาไป",川が流れています。,แม่น้ำกำลังไหล
亡くす,なくす,to lose someone,JLPT JLPT_2 JLPT_3,KL@%|R=4Tw,"การสูญเสียใครบางคน, เสียคน, สูญเสีย, พลัดพราก",母を亡くしました。,ฉันเสียแม่ไป
殴る,なぐる,to strike; to hit; to punch,JLPT JLPT_3 JLPT_2 Genki Genki_Ln.21,eS]UZnH]O8,"ตี; กระแทก; ชก, ต่อย, ซัด, ฟาด",彼は友達を殴りました。,เขาต่อยเพื่อน
無し,なし,without,JLPT JLPT_2 JLPT_3,tUofx+jM%K,"ปราศจาก, ไม่มี, ปราศจากซึ่ง, ไร้",問題はありません。,ไม่มีปัญหา
なぜなら,なぜなら,because,JLPT JLPT_2 JLPT_3,H{Gk:ou^*M,"เพราะ, เนื่องจาก, เหตุเพราะ, เพราะว่า",遅刻しました。なぜなら、電車が遅れたからです。,ฉันมาสาย เพราะรถไฟล่าช้า
謎,なぞ,"riddle, puzzle, enigma",JLPT JLPT_2 JLPT_3,"NDO,I}[;_1","ปริศนา, ปัญหา, ความลึกลับ, คำทาย",これは謎です。,นี่คือปริศนา
納得,なっとく,"consent, assent, understanding",JLPT JLPT_2 JLPT_3,JuwJ4CGSR`,"ความยินยอม, การเห็นชอบ, ความเข้าใจ, การยอมรับ",彼の説明に納得しました。,ฉันเข้าใจคำอธิบายของเขา
何か,なにか,something,JLPT JLPT_3 JLPT_2 Genki_Ln.8 Genki,j.C?;uY)C5,"บางสิ่งบางอย่าง, บางอย่าง, สิ่งของ, บางสิ่ง",何か食べたいです。,ฉันอยากกินอะไรสักอย่าง
なにも,なにも,nothing,JLPT JLPT_2 JLPT_3,MXWN];^p1V,"ไม่มีอะไร, ไม่มีสิ่งใด, เปล่า, ไม่ได้มีอะไร",何もありません。,ไม่มีอะไรเลย
鍋,なべ,"saucepan, pot",JLPT JLPT_2 JLPT_3,mwf<LRd<l+,"หม้อ, กระทะ, ภาชนะ, หม้อหุงข้าว",鍋で料理をします。,ฉันทำอาหารในหม้อ
生,なま,"raw, unprocessed",JLPT JLPT_2 JLPT_3,r*Fk8g)/r@,"ดิบ ไม่ผ่านกระบวนการแปรรูป, สด, ดิบๆ, ไม่สุก",これは生魚です。,นี่คือปลาดิบ
怠ける,なまける,"to be idle, to neglect",JLPT JLPT_2 JLPT_3,"yx?2EFwB,]","อยู่เฉยๆ ละเลย, เกียจคร้าน, ไม่ทำงาน, ขี้เกียจ",彼は勉強を怠けています。,เขาขี้เกียจเรียน
