expression,reading,meaning,tags,guid,ความหมาย,jp_sentence,th_sentence
作法,さほう,"manners, etiquette, propriety",JLPT JLPT_2 JLPT_3,HYeQ[!t+v+,"มารยาท, การวางตัว, ความเหมาะสม, กิริยา",食事の作法を習いました。,ฉันเรียนรู้วิธีการรับประทานอาหาร
様々,さまざま,"varied, various",JLPT JLPT_2 JLPT_3,l>?/o{CjV<,"หลากหลาย ต่างๆ, นานา, หลายชนิด, หลายอย่าง",様々 な花があります。,มีดอกไม้หลากหลายชนิด
冷ます,さます,"to cool, to let cool",JLPT JLPT_2 JLPT_3,m(o0n4^}Z$,"ทำให้เย็นลง, ปล่อยให้เย็นลง, คลายความร้อน, ทำให้หายร้อน",コーヒーを冷ましてください。,กรุณาทำให้กาแฟเย็นลงด้วย
覚ます,さます,to awaken,JLPT JLPT_2 JLPT_3,t9@aJ[u<UZ,"เพื่อปลุกให้ตื่น, ปลุก, ทำให้ตื่น, เรียกให้ตื่น",子供が起きました。もう覚ましました。,เด็กตื่นแล้ว ตื่นแล้ว
冷める,さめる,"to become cool, to wear off",JLPT JLPT_2 JLPT_3,LR.A;82:W|,"เพื่อให้เย็นลง เพื่อให้หมดฤทธิ์, เย็นลง, จางลง, ลดน้อยลง",熱が冷めました。,ไข้ลดลงแล้ว
覚める,さめる,"to wake, to wake up",JLPT JLPT_2 JLPT_3,Dob+O4(+<L,"ตื่น, ปลุกให้ตื่น, ลืมตา, ฟื้น",朝、早く覚めました。,ฉันตื่นแต่เช้า
左右,さゆう,left and right; influence,JLPT JLPT_2 JLPT_3,d8br}6f4&T,"ซ้ายและขวา; อิทธิพล, ด้านซ้ายขวา, การชักนำ, การมีผล",左右を見てください。,กรุณามองไปทางซ้ายและขวา
皿,さら,"plate, dish",JLPT Genki_Ln.14 JLPT_3 JLPT_2 Genki,p*f@mDk_ih,"จาน, ชาม, ภาชนะ, ถ้วย",この皿はきれいです。,จานใบนี้สวยงาม
更に,さらに,"furthermore, moreover",JLPT JLPT_2 JLPT_3,n=YLy+|9V>,"นอกจากนี้ ยิ่งไปกว่านั้น, เพิ่มเติมนอกจากนี้, ยิ่งไปกว่านั้นอีก, ยังอีกด้วย",さらに、本を読みます。,นอกจากนี้ ฉันจะอ่านหนังสือด้วย
去る,さる,"to leave, to go away",JLPT JLPT_2 JLPT_3,q:@^dVE|Ux,"จากไป, ออกเดินทาง, จากไปแล้ว, เคลื่อนไป",来月、友達が去ります。,เดือนหน้าเพื่อนจะจากไป
猿,さる,monkey,JLPT JLPT_3 JLPT_2 Genki_Ln.22 Genki,I;FmV}C|Mm,"ลิง, วานร, กัง, กะบี่",猿が木に登りました。,ลิงปีนขึ้นต้นไม้
騒ぎ,さわぎ,"uproar, disturbance",JLPT JLPT_2 JLPT_3,"b-,^J/-<a(","ความวุ่นวาย ความโกลาหล, ความไม่สงบ, ความชุลมุน, ความปั่นป่วน",外で騒ぎがあります。,มีเสียงอึกทึกข้างนอก
参加,さんか,participation,JLPT JLPT_2 JLPT_3,NJ??D?6U!^,"การมีส่วนร่วม, การเข้าร่วม, การร่วมมือ, การสมทบ",会議に私も参加します。,ฉันจะเข้าร่วมการประชุมด้วย
参考,さんこう,"reference, consultation",JLPT JLPT_2 JLPT_3,Han8<B?^r0,"การอ้างอิง การปรึกษาหารือ, การอ้างถึง, การขอคำแนะนำ, การเทียบเคียง",この本は参考になります。,หนังสือเล่มนี้มีประโยชน์ในการอ้างอิง
賛成,さんせい,"approval, agreement",JLPT JLPT_2 JLPT_3,"emfZ/!E,?[","การอนุมัติ ข้อตกลง, การเห็นด้วย, การยินยอม, การรับรอง",その意見に賛成です。,ฉันเห็นด้วยกับความคิดเห็นนั้น
酸性,さんせい,acidity,JLPT JLPT_2 JLPT_3,geVhjMXt@#,"ความเป็นกรด, ฤทธิ์เป็นกรด, สภาพเป็นกรด, มีรสเปรี้ยว",この液は酸性です。,ของเหลวนี้มีฤทธิ์เป็นกรด
酸素,さんそ,oxygen,JLPT JLPT_2 JLPT_3,DM##q[%RFu,"ออกซิเจน, ธาตุออกซิเจน, แก๊สออกซิเจน, สารออกซิเจน",人間は酸素が必要です。,มนุษย์ต้องการออกซิเจน
氏,し,"family name, lineage",JLPT JLPT_2 JLPT_3,LAOK_nHPS/,"นามสกุล, วงศ์ตระกูล, ตระกูล, แซ่",田中さんの友達です。,เป็นเพื่อนของคุณทานากะ
詩,し,poem; poetry,JLPT Intermediate_Japanese JLPT_3 JLPT_2 Intermediate_Japanese_Ln.13,PI;rr><.*1,"บทกวี; กวีนิพนธ์, โคลง, กลอน, ฉันท์",有名な詩を読みました。,ฉันได้อ่านบทกวีที่มีชื่อเสียง
幸せ,しあわせ,"happiness, blessing",JLPT JLPT_2 JLPT_3,MYpn~@*11o,"ความสุข, พร, ความรื่นรมย์, ความเป็นสิริมงคล",幸せな家族です。,เป็นครอบครัวที่มีความสุข
ジーンズ,ジーンズ,jeans,JLPT JLPT_3 JLPT_2 Genki_Ln.2 Genki,o3hhzYEH)l,"ยีนส์, กางเกงยีนส์, ผ้ายีนส์, เดนิม",ジーンズをはきます。,ฉันสวมกางเกงยีนส์
ジェット機,ジェットき,jet plane,JLPT JLPT_2 JLPT_3,fS!]EX&j7m,"เครื่องบินเจ็ต, เครื่องบินไอพ่น, เครื่องบินความเร็วสูง, เจ็ต",ジェット機が飛びました。,เครื่องบินเจ็ตบินขึ้นไป
四角,しかく,square,JLPT JLPT_2 JLPT_3,J[L(f7xE~B,"สี่เหลี่ยม, รูปสี่เหลี่ยม, จัตุรัส, สี่มุมฉาก",四角い箱があります。,มีกล่องสี่เหลี่ยม
直に,じかに,"immediately, readily, directly",JLPT JLPT_2 JLPT_3,"Gui,0]IdY5","ทันที อย่างรวดเร็ว โดยตรง, ในทันที, อย่างตรงไปตรงมา, โดยพลัน",直に会議を始めます。,เราจะเริ่มประชุมทันที
しかも,しかも,"moreover, furthermore, besides, plus",JLPT Intermediate_Japanese JLPT_3 JLPT_2 Intermediate_Japanese_Ln.9 Intermediate_Japanese_Ln.2,NW!O~u6B#],"ยิ่งไปกว่านั้น นอกจากนี้ บวกกับ, มิหนำซ้ำ, นอกจากนั้น, รวมถึง",この本は面白い。しかも安い。,หนังสือเล่มนี้สนุก และยังมีราคาถูกอีกด้วย
四季,しき,four seasons,JLPT JLPT_2 JLPT_3,j=w0weSQi),"สี่ฤดู, ฤดูกาลทั้งสี่, สี่ช่วงฤดู, สี่ฤดูการ",四季があります。,มีสี่ฤดู
直,じき,"immediately, soon, shortly",JLPT JLPT_2 JLPT_3,wd?tx<3Bac,"ทันที เร็วๆ นี้ ในไม่ช้า, โดยเร็ว, ในเร็ววัน, เดี๋ยวนี้",直に連絡します。,ฉันจะติดต่อกลับทันที
時期,じき,"time, season, period",JLPT JLPT_2 JLPT_3,DJ<W>Fb$j>,"เวลา ฤดูกาล ช่วงเวลา, คราว, กาลเวลา, ห้วงเวลา",良い時期です。,เป็นช่วงเวลาที่ดี
支給,しきゅう,"payment, allowance",JLPT JLPT_2 JLPT_3,MpCDrKuR@c,"การจ่ายเงิน, ค่าเบี้ยเลี้ยง, เงินจ่าย, ค่าตอบแทน",給料の支給日です。,เป็นวันจ่ายเงินเดือน
至急,しきゅう,"urgent, pressing",JLPT JLPT_2 JLPT_3,"K+,ttKQ<dz","ด่วน เร่งด่วน, ฉุกเฉิน, รีบด่วน, สำคัญเร่งด่วน",至急、連絡してください。,กรุณาติดต่อกลับโดยด่วน
しきりに,しきりに,"frequently, repeatedly, eagerly",JLPT JLPT_2 JLPT_3,E|Rw@W(/Em,"บ่อยครั้ง ซ้ำแล้วซ้ำเล่า อย่างกระตือรือร้น, บ่อยๆ, ซ้ำๆ, ไม่หยุดหย่อน",彼女はしきりに笑いました。,เธอหัวเราะไม่หยุด
刺激,しげき,"stimulus, impetus, incentive",JLPT JLPT_2 JLPT_3,PD*^rLK60i,"สิ่งกระตุ้น แรงผลักดัน สิ่งจูงใจ, แรงกระตุ้น, สิ่งเร้า, สิ่งชักจูง",この音楽は刺激的です。,ดนตรีนี้เร้าใจ
資源,しげん,resources,JLPT JLPT_2 JLPT_3,m(PG+T&|gr,"ทรัพยากร, แหล่งทรัพยากร, ปัจจัย, สินทรัพย์",資源を大切にしましょう。,เรามารักษาสิ่งแวดล้อมกันเถอะ
事件,じけん,"event, affair, incident",JLPT JLPT_2 JLPT_3,MbFCnlA+g8,"เหตุการณ์, เรื่องราว, อุบัติการณ์, กรณี",怖い事件がありました。,มีเหตุการณ์ที่น่ากลัวเกิดขึ้น
時刻,じこく,"time, hour",JLPT JLPT_2 JLPT_3,"oN.E,s)Z}n","เวลา, ชั่วโมง, โมง, นาฬิกา",時刻は何時ですか。,เวลากี่โมงแล้ว
自殺,じさつ,suicide,JLPT JLPT_2 JLPT_3,y#JDw}f8E1,"การฆ่าตัวตาย, อัตวินิบาตกรรม, ปลิดชีพตัวเอง, จบชีวิตตัวเอง",自殺は絶対にしてはいけません。,ห้ามฆ่าตัวตายเด็ดขาด
事実,じじつ,"fact, truth, reality",JLPT JLPT_2 JLPT_3,qUB-Jtt?i`,"ข้อเท็จจริง ความจริง ความเป็นจริง, ความจริงแท้, สัจธรรม, สิ่งที่เป็นจริง",これは事実ですか。,นี่คือความจริงหรือไม่
支出,ししゅつ,"expenditure, expenses",JLPT JLPT_2 JLPT_3,PrmuroD(_w,"ค่าใช้จ่าย, รายจ่าย, เงินที่ใช้จ่าย, รายจ่ายประจำ",支出が多いです。,รายจ่ายมีมาก
事情,じじょう,"circumstances, situation, reasons",JLPT JLPT_2 JLPT_3,B&D.VmCJRe,"สถานการณ์, เหตุผล, สภาวการณ์, สาเหตุ",事情を説明してください。,กรุณาอธิบายสถานการณ์
詩人,しじん,poet,JLPT JLPT_2 JLPT_3,J|*bb(L^Qr,"กวี, นักประพันธ์กลอน, ผู้แต่งบทกวี, นักกลอน",彼は有名な詩人です。,เขาเป็นกวีที่มีชื่อเสียง
自身,じしん,oneself,JLPT Intermediate_Japanese JLPT_3 JLPT_2 Intermediate_Japanese_Ln.14,Mms_kL$qBA,"ตัวเอง, ตนเอง, ตัวตน, ของตัวเอง",自身で頑張ってください。,ขอให้คุณพยายามด้วยตัวเอง
沈む,しずむ,to sink; to feel depressed,JLPT JLPT_2 JLPT_3,v(wY-5e=dv,"จมดิ่ง; รู้สึกหดหู่, จมลง, รู้สึกเศร้า, ซึมเศร้า",海に沈みました。,จมลงไปในทะเล
自然,しぜん,"nature, spontaneous",JLPT JLPT_2 JLPT_3,K#D]Lme)]J,"ธรรมชาติ, เกิดขึ้นเองโดยธรรมชาติ, โดยธรรมชาติ, ตามธรรมชาติ",自然が好きです。,ฉันชอบธรรมชาติ
思想,しそう,"thought, idea",JLPT JLPT_2 JLPT_3,"udM,dvR}EZ","ความคิด, ไอเดีย, แนวคิด, ดำริ",新しい思想です。,เป็นความคิดใหม่
舌,した,tongue,JLPT JLPT_2 JLPT_3,i22E-x*lSS,"ลิ้น, อวัยวะลิ้น, โคนลิ้น, ปลายลิ้น",舌が痛いです。,เจ็บลิ้น
次第,しだい,order; circumstances; immediate(ly),JLPT JLPT_2 JLPT_3,m7IQESq>:Z,"คำสั่ง; สถานการณ์; ทันที(), ลำดับ, ตามแต่, ทันใด",準備ができた次第、連絡します。,เมื่อเตรียมการเสร็จแล้วจะแจ้งให้ทราบ
従う,したがう,"to abide (by the rules), to obey",JLPT JLPT_2 JLPT_3,jQOK[Z2G2a,"ปฏิบัติตาม (กฎระเบียบ) เชื่อฟัง, ทำตาม, เคารพกฎ, เชื่อฟังคำสั่ง",先生の言うことを従います。,ฉันจะทำตามที่คุณครูบอก
したがって,したがって,"therefore, consequently",JLPT JLPT_2 JLPT_3,zE+XZL-yO%,"ดังนั้น ผลที่ตามมาคือ, เพราะฉะนั้น, ฉะนั้น, เป็นผลให้",雨が降っています。したがって、傘を持っていきます。,ฝนกำลังตก ดังนั้นฉันจะพกร่มไปด้วย
親しい,したしい,"intimate, close (e.g., friend)",JLPT JLPT_2 JLPT_3,JLb1]#eUH.,"สนิทสนม, ใกล้ชิด (เช่น เพื่อน), คุ้นเคย, เป็นกันเอง",彼は私の親しい友達です。,เขาเป็นเพื่อนสนิทของฉัน
質,しつ,"quality, nature (of person)",JLPT JLPT_2 JLPT_3,i9bGgE8&)u,"คุณภาพ, ลักษณะ (ของบุคคล), คุณสมบัติ, นิสัย",この品の質は良いです。,คุณภาพของสินค้าชิ้นนี้ดี
失業,しつぎょう,unemployment,JLPT JLPT_2 JLPT_3,L*e(K1S8y>,"การว่างงาน, ภาวะว่างงาน, ตกงาน, ไม่มีงานทำ",失業して困っています。,ฉันกำลังลำบากเพราะตกงาน
湿気,しっけ,"moisture, humidity, dampness",JLPT JLPT_2 JLPT_3,mI:_~nX$Y!,"ความชื้น, ความเปียกชื้น, ความอับชื้น",湿気が多いです。,มีความชื้นสูง
実験,じっけん,lab work; experiment,JLPT Intermediate_Japanese JLPT_3 JLPT_2 Intermediate_Japanese_Ln.5,hmPfhao45;,"งานในห้องปฏิบัติการ; การทดลอง, การทดสอบ, การวิเคราะห์, การปฏิบัติการ",実験をしました。,ฉันได้ทำการทดลอง
実現,じつげん,"implementation, materialization, realization",JLPT JLPT_2 JLPT_3,fGH.>rJnym,"การนำไปปฏิบัติ การทำให้เป็นรูปธรรม การทำให้เป็นจริง, การทำให้สำเร็จ, การเกิดขึ้นจริง, การทำให้เป็นรูปเป็นร่าง",夢が実現しました。,ความฝันของฉันเป็นจริงแล้ว
実行,じっこう,"practice, execution (e.g., program), realization",JLPT JLPT_2 JLPT_3,O_Qp[P4rQP,"การปฏิบัติ การดำเนินการ (เช่น โปรแกรม) การทำให้เป็นจริง, การดำเนินการ, การกระทำ, การทำให้เกิดผล",計画を実行します。,ฉันจะดำเนินการตามแผน
実際,じっさい,in fact; in actuality,JLPT Intermediate_Japanese JLPT_3 JLPT_2 Intermediate_Japanese_Ln.15,"B6Z:.Y11k,","ในความเป็นจริง; ตามความเป็นจริง, อันที่จริง, ตามจริง, ในทางปฏิบัติ",実際は違います。,ในความเป็นจริงมันแตกต่างออกไป
実施,じっし,"enforcement, carry out, operation",JLPT JLPT_2 JLPT_3,dXLqmB^MiP,"การบังคับใช้, การดำเนินการ, การปฏิบัติการ, การดำเนินงาน",新しい法律が実施されます。,กฎหมายใหม่จะถูกบังคับใช้
湿度,しつど,humidity,JLPT JLPT_2 JLPT_3,lZGX2R~;Bn,"ความชื้น, ระดับความชื้น, ไอชื้น, ความเปียก",湿度が上がりました。,ความชื้นสูงขึ้น
じっと,じっと,"patiently, quietly",JLPT JLPT_2 JLPT_3,Nkvz[eNt`n,"อย่างอดทนและเงียบๆ, อย่างสงบ, อย่างเงียบเชียบ, อย่างอดกลั้น",じっと見ていました。,ฉันมองอย่างไม่กระพริบตา
実に,じつに,"indeed, truly, surely",JLPT JLPT_2 JLPT_3,I|OQWMaQog,"จริงแท้แน่นอน, แท้จริงแล้ว, แน่นอนที่สุด, เป็นจริง",実に素晴らしいです。,มันยอดเยี่ยมจริงๆ
実は,じつは,actually; in fact,JLPT Intermediate_Japanese JLPT_3 JLPT_2 Intermediate_Japanese_Ln.1,s#X::H+4<F,"จริงๆ; ในความเป็นจริง, อันที่จริงแล้ว, ความจริงแล้ว, แท้ที่จริง",実は、友達が来ました。,อันที่จริงแล้ว เพื่อนของฉันมา
失望,しつぼう,"disappointment, despair",JLPT JLPT_2 JLPT_3,mi8g|r~Txf,"ความผิดหวัง ความสิ้นหวัง, ความท้อแท้, ความหมดหวัง, ความเสียใจ",失望しないでください。,อย่าเพิ่งสิ้นหวัง
実力,じつりょく,ability; force,JLPT JLPT_2 JLPT_3,F5g81kES4+,"ความสามารถ; พลัง, ศักยภาพ, พละกำลัง, ความสามารถพิเศษ",実力があります。,เขามีความสามารถ
支店,してん,branch store (office),JLPT JLPT_3 JLPT_2 Genki_Ln.20 Genki,h*O$^StSa>,"สาขา (สำนักงาน), สำนักงานสาขา, ร้านสาขา, หน่วยงานสาขา",これは東京支店です。,นี่คือสาขากรุงโตเกียว
指導,しどう,"leadership, guidance, coaching",JLPT JLPT_2 JLPT_3,AKsjeKTYcK,"ความเป็นผู้นำ การให้คำแนะนำ การฝึกสอน, การชี้นำ, การแนะนำ, การเป็นผู้นำ",先生が指導してくれます。,คุณครูจะให้คำแนะนำ
自動,じどう,"automatic, self-motion",JLPT JLPT_2 JLPT_3,O4.zUw/o_S,"อัตโนมัติ เคลื่อนไหวเอง, โดยอัตโนมัติ, ขับเคลื่อนเอง, ทำงานเอง",自動ドアが開きました。,ประตูอัตโนมัติเปิดออก
児童,じどう,"children, juvenile",JLPT JLPT_2 JLPT_3,"e,|tEbv]Zq","เด็ก เยาวชน, ลูก, ผู้เยาว์, กุมาร",児童文学を読みます。,ฉันอ่านวรรณกรรมเด็ก
品,しな,"thing, article, goods",JLPT JLPT_2 JLPT_3,bDnAvhtlH7,"สิ่งของ บทความ สินค้า, ของ, ผลิตภัณฑ์, เครื่องใช้",この品は人気があります。,สินค้านี้ได้รับความนิยม
支配,しはい,"rule, control, direction",JLPT JLPT_2 JLPT_3,GJx2Cizi1x,"กฎ, การควบคุม, ทิศทาง, การปกครอง",彼が支配しています。,เขาเป็นผู้ควบคุม
芝居,しばい,"play, drama",JLPT JLPT_2 JLPT_3,gtSlTkyCFW,"ละคร, การแสดง, บทละคร, การแสดงละคร",芝居を見に行きました。,ฉันไปดูละคร
しばしば,しばしば,"often, again and again, frequently",JLPT JLPT_2 JLPT_3,oKzAa``eqH,"บ่อยครั้ง ซ้ำแล้วซ้ำเล่า บ่อยๆ, เป็นประจำ, อยู่เสมอ, เป็นนิตย์",しばしば訪れます。,ฉันไปเยี่ยมบ่อยๆ
芝生,しばふ,lawn,JLPT JLPT_2 JLPT_3,"wbx:,PABM*","สนามหญ้า, ทุ่งหญ้า, บริเวณหญ้า, พื้นที่หญ้า",庭に芝生があります。,มีสนามหญ้าในสวน
支払,しはらい,payment,JLPT JLPT_2 JLPT_3,Ev?:EQ7Ks`,"การชำระเงิน, การจ่าย, การชำระ, ค่าธรรมเนียม",支払いは済ませました。,ฉันได้ชำระเงินแล้ว
支払う,しはらう,to pay,JLPT JLPT_2 JLPT_3,"ND2,<K].}x","เพื่อจ่าย, จ่ายเงิน, ชำระเงิน, ออกเงิน",お店に支払いました。,ฉันจ่ายเงินให้กับร้านค้า
死亡,しぼう,death,JLPT JLPT_2 JLPT_3,zYjIN3r3C,"ความตาย, การเสียชีวิต, มรณะ, สิ้นชีวิต",死亡事故は起こりませんでした。,ไม่มีอุบัติเหตุเสียชีวิตเกิดขึ้น
資本,しほん,"funds, capital",JLPT JLPT_2 JLPT_3,K]eJp4bmn-,"เงินทุน, ทุน, เงินต้น, ทุนทรัพย์",資本金が必要です。,ต้องการเงินทุน
姉妹,しまい,sisters,JLPT JLPT_2 JLPT_3,D=K+>4{9gs,"พี่สาวน้องสาว, พี่สาว, น้องสาว, สตรีพี่น้อง",姉妹が二人います。,มีพี่สาวน้องสาวสองคน
しまった (かん),しまった (かん),Damn it!,JLPT JLPT_2 JLPT_3,lG^NNUo)xn,"แย่แล้ว!, ให้ตายสิ!, ซวยจริง!, เวรเอ๊ย!",しまった！宿題を忘れた。,แย่แล้ว! ลืมการบ้าน
自慢,じまん,"pride, boast",JLPT JLPT_2 JLPT_3,I/xy:2]J/|,"ความภาคภูมิใจ ความโอ้อวด, ความภูมิใจ, การอวด, ความหยิ่ง",自分の自慢をします。,ฉันจะคุยโอ้อวดตัวเอง
地味,じみ,"quiet, plain, conservative",JLPT JLPT_2 JLPT_3,o(yU(Vt?_.,"เงียบ เรียบง่าย อนุรักษ์นิยม, สงบ, ธรรมดา, แบบเก่า",地味な服を着ています。,ฉันใส่ชุดเรียบง่าย
示す,しめす,"to show, to indicate",JLPT JLPT_2 JLPT_3,Jd8*LeirRj,"เพื่อแสดง เพื่อบ่งชี้, แสดงให้เห็น, บ่งบอก, ชี้ให้เห็น",地図を示してください。,กรุณาแสดงแผนที่
占める,しめる,to take up; to account for,JLPT Intermediate_Japanese JLPT_3 JLPT_2 Intermediate_Japanese_Ln.14,r`M6Y4!/$F,"หยิบยกขึ้นมา; ชี้แจง, รับผิดชอบ, ครอบครอง, แถลง",この部屋を占めています。,เขาครอบครองห้องนี้
湿る,しめる,"to be wet, to be damp",JLPT JLPT_2 JLPT_3,uFiSD0nBbH,"เปียกชื้น, ชุ่มชื้น, เปียกปอน, เฉอะแฉะ",雨で服が湿りました。,เสื้อผ้าของฉันเปียกฝน
下,しも,"under, below, beneath",JLPT JLPT_2 JLPT_3,"NEdu]f-jA,","ใต้, ข้างล่าง, เบื้องล่าง",棚の下にあります。,มันอยู่ใต้ชั้น
