面倒,めんどう,"trouble, attention",JLPT JLPT_2 JLPT_3,jarwg?`xYM,"ปัญหา ความสนใจ, เรื่องยุ่งยาก, ความลำบาก, อุปสรรค",この仕事は面倒です。,งานนี้ยุ่งยาก
メンバー,メンバー,member,JLPT JLPT_2 JLPT_3,ioP<e}C#*T,"สมาชิก, ผู้ร่วม, พลพรรค, แก๊ง",彼はチームのメンバーです。,เขาเป็นสมาชิกของทีม
申し込む,もうしこむ,"to apply for, to make an application",JLPT Intermediate_Japanese JLPT_3 JLPT_2 Intermediate_Japanese_Ln.3,p-@iqxnx(*,"สมัคร, ยื่นใบสมัคร, ขอสมัคร, ลงทะเบียน",パーティーに申し込みました。,สมัครงานปาร์ตี้แล้ว
申し訳,もうしわけ,"apology, excuse",JLPT JLPT_2 JLPT_3,"w0A,13h@XG","คำขอโทษ, ข้อแก้ตัว, ขออภัย, การให้อภัย",遅れて申し訳ありません。,ขอโทษที่มาสาย
毛布,もうふ,blanket,JLPT JLPT_2 JLPT_3,G|6QSL6HzW,"ผ้าห่ม, ผ้าคลุม, ผ้านวม, พรม",毛布をかけます。,คลุมผ้าห่ม
燃える,もえる,to burn,JLPT JLPT_2 JLPT_3,C2}(_d=*8],"เพื่อเผา, เผาไหม้, ลุกไหม้, ติดไฟ",火が燃えています。,ไฟกำลังไหม้
目的,もくてき,"purpose, goal, aim",JLPT Intermediate_Japanese JLPT_3 JLPT_2 Intermediate_Japanese_Ln.3,"FrxXy0,/EI","จุดประสงค์ เป้าหมาย จุดมุ่งหมาย, วัตถุประสงค์, เจตนา, ความตั้งใจ",旅行の目的は何ですか。,จุดประสงค์ของการเดินทางคืออะไร
目標,もくひょう,"mark, objective, target",JLPT JLPT_2 JLPT_3,eD#(2kEfi#,"เครื่องหมาย, วัตถุประสงค์, เป้าหมาย, จุดหมาย",目標を達成しました。,บรรลุเป้าหมายแล้ว
文字,もじ,"letter (of alphabet), character",JLPT JLPT_2 JLPT_3,v{bw_z2KT.,"ตัวอักษร (ของอักษร), อักขระ, พยัญชนะ, สัญลักษณ์",この文字は読めません。,อ่านตัวอักษรนี้ไม่ออก
文字,もんじ,"letter (of alphabet), character",JLPT JLPT_2 JLPT_3,i}R1C0Kg[i,"ตัวอักษร (ของอักษร), อักขระ, ตัวเขียน, ตัวหนังสือ",新しい文字を習います。,กำลังเรียนตัวอักษรใหม่
もしかすると,もしかすると,"perhaps, maybe, by some chance",JLPT JLPT_2 JLPT_3,E_gTNRA!W1,"บางที อาจจะโดยบังเอิญ, อาจจะ, ไม่แน่ว่า, เป็นไปได้",もしかすると、雨が降るかもしれません。,บางทีฝนอาจจะตก
もしも,もしも,if,JLPT JLPT_2 JLPT_3,Q41Ox`49(P,"ถ้า, หาก, สมมติว่า, ในกรณีที่",もしも、お金があったら、旅行に行きたいです。,ถ้ามีเงิน อยากไปเที่ยว
持ち上げる,もちあげる,"to raise, to lift up, to flatter",JLPT JLPT_2 JLPT_3,Ck3.ZXZ[6p,"ยกขึ้น, ยกระดับ, ประจบประแจง, ชูขึ้น",重い箱を持ち上げました。,ยกกล่องหนักขึ้น
用いる,もちいる,"to use, to make use of",JLPT JLPT_2 JLPT_3,so5H6d<zN+,"ใช้, เพื่อใช้ประโยชน์, นำมาใช้, ประยุกต์ใช้",この道具を用います。,ใช้เครื่องมือนี้
もったいない,もったいない,"wasteful; more than one deserves, unworthy of",JLPT JLPT_2 JLPT_3,yewBxbz7]I,"สิ้นเปลือง; มากเกินควร ไม่คู่ควร, น่าเสียดาย, เสียของ, ไม่มีค่า",もったいないことをしました。,ทำอะไรที่น่าเสียดาย
尤も,もっとも,"quite right, plausible, natural",JLPT JLPT_2 JLPT_3,A>F:Ft1w22,"ถูกต้อง สมเหตุสมผล เป็นธรรมชาติ, สมควร, สมจริง, เป็นจริง",それはもっともな意見です。,นั่นเป็นความเห็นที่สมเหตุสมผล
元,もと,"origin, original; former",JLPT JLPT_2 JLPT_3,"O)La7,`]AY","ต้นกำเนิด, ดั้งเดิม; เดิม, รากฐาน, แต่แรก",昔の元町を歩きます。,เดินเล่นในเมืองเก่าแก่
基,もと,basis,JLPT JLPT_2 JLPT_3,Icp_M75Xpg,"พื้นฐาน, รากฐาน, หลัก, จุดเริ่มต้น",この建物は丈夫な基盤の上にあります。,อาคารนี้ตั้งอยู่บนฐานรากที่แข็งแรง
素,もと,prime,JLPT JLPT_2 JLPT_3,yGr3{oX4%H,"ไพรม์, หลัก, สำคัญ, ดั้งเดิม",米は日本の素食です。,ข้าวเป็นอาหารหลักของญี่ปุ่น
戻す,もどす,"to restore, to put back, to return",JLPT JLPT_2 JLPT_3,PmY(.gc-w+,"เพื่อฟื้นฟู, เพื่อนำกลับมา, เพื่อส่งคืน, คืน",元の場所に戻してください。,กรุณาคืนสู่ที่เดิม
基づく,もとづく,"to be grounded on, to be based on",JLPT JLPT_2 JLPT_3,I&bTc?WHhL,"เพื่อเป็นพื้นฐาน เพื่อยึดเป็นหลัก, อิงตาม, โดยอาศัย, มีหลักการจาก",法律に基づいた判断。,การตัดสินที่อิงตามกฎหมาย
求める,もとめる,"to request, to ask for; to seek, to search for",JLPT Intermediate_Japanese JLPT_3 JLPT_2 Intermediate_Japanese_Ln.4,lJ&@p010:m,"ขอร้อง, วิงวอน; ค้นหา, แสวงหา, ต้องการ",幸せを求めます。,แสวงหาความสุข
者,もの,person (same as 人 (ひと)),JLPT Intermediate_Japanese JLPT_3 JLPT_2 Intermediate_Japanese_Ln.3,vAI([v0H/E,"คน (เช่นเดียวกับ 人 (ひと)), มนุษย์, บุคคล, ผู้คน",これは良い者です。,นี่เป็นคนดี
物音,ものおと,sounds,JLPT JLPT_2 JLPT_3,hL<`ZEm#E^,"เสียง, สุรเสียง, สัททะ, สำเนียง",物音がしました。,มีเสียงอะไรบางอย่าง
物語,ものがたり,"tale, story, legend",JLPT JLPT_2 JLPT_3,b2F39/cX@{,"นิทาน, เรื่องเล่า, ตำนาน, เรื่องราว",面白い物語を読みました。,ได้อ่านเรื่องราวที่น่าสนใจ
物事,ものごと,"things, everything",JLPT JLPT_2 JLPT_3,JYu;9)KWYP,"สิ่งของ ทุกอย่าง, วัตถุ, ของใช้, ข้าวของ",色々な物事があります。,มีสิ่งต่างๆ มากมาย
燃やす,もやす,to burn,JLPT JLPT_2 JLPT_3,h5FjFnJT{r,"เพื่อเผา, จุดไฟ, ลน, สุมไฟ",ゴミを燃やします。,เผาขยะ
模様,もよう,"pattern, figure, design",JLPT JLPT_2 JLPT_3,DCW6|C<9T),"ลวดลาย, รูปทรง, การออกแบบ, แบบแผน",きれいな模様の布。,ผ้าที่มีลวดลายสวยงาม
文句,もんく,a complaint,JLPT Intermediate_Japanese Genki JLPT_3 JLPT_2 Intermediate_Japanese_Ln.14 Genki_Ln.21 Intermediate_Japanese_Ln.11,"q,87=b37fY","การร้องเรียน, การบ่น, การตำหนิ, ข้อร้องทุกข์",文句を言わないでください。,กรุณาอย่าบ่น
やがて,やがて,"before long, soon, at length",JLPT Intermediate_Japanese JLPT_3 JLPT_2 Intermediate_Japanese_Ln.8,nlnms.mL_|,"ในไม่ช้า เร็วๆ นี้ ในที่สุด, ไม่นาน, อีกไม่นาน, ท้ายที่สุด",やがて春になります。,ในไม่ช้าก็จะเป็นฤดูใบไม้ผลิ
役,やく,"role, position",JLPT JLPT_2 JLPT_3,sc=i9?h^tQ,"บทบาท ตำแหน่ง, หน้าที่, ฐานะ, สถานะ",社長の役をします。,ทำหน้าที่ประธานบริษัท
約,やく,"approximately, about, some",JLPT Intermediate_Japanese JLPT_3 JLPT_2 Intermediate_Japanese_Ln.11,L31l;C5Xp=,"ประมาณ, เกี่ยวกับ, บางส่วน, ราวๆ",約1時間かかります。,ใช้เวลาประมาณ 1 ชั่วโมง
訳,やく,translation,JLPT JLPT_2 JLPT_3,CmgPQjblgT,"การแปล, การถอดความ, การถ่ายทอด, การตีความ",日本語を英語に訳します。,แปลภาษาญี่ปุ่นเป็นภาษาอังกฤษ
訳す,やくす,to translate,JLPT Intermediate_Japanese JLPT_3 JLPT_2 Intermediate_Japanese_Ln.2,Cj2Ni~H!BW,"เพื่อแปล, ถอดความ, ถ่ายทอด, ตีความ",この本を訳してください。,กรุณาแปลหนังสือเล่มนี้
役割,やくわり,"assigning (allotment of) parts, role, duties",JLPT JLPT_2 JLPT_3,"jj*z,nk6$Z","การมอบหมาย (จัดสรร) ส่วนต่างๆ บทบาท หน้าที่, การแบ่งปัน, การปันส่วน, การจัดสรร",大切な役割を果たす。,มีบทบาทสำคัญ
家賃,やちん,rent,JLPT Genki_Ln.18 JLPT_3 JLPT_2 Genki,Og7<v^:R8@,"เช่า, การเช่า, ค่าเช่าบ้าน, ค่าเช่าที่",家賃はいくらですか。,ค่าเช่าเท่าไหร่
厄介,やっかい,"trouble, burden, care",JLPT JLPT_2 JLPT_3,O_#+8qFx*C,"ความลำบาก ภาระ การดูแล, ความยุ่งยาก, ความหนักใจ, การเป็นห่วง",面倒なことになりそうだ。,ดูเหมือนว่าจะเป็นเรื่องยุ่งยาก
宿,やど,"inn, lodging",JLPT JLPT_2 JLPT_3,F8A%9EzpfO,"โรงแรม ที่พัก, ที่พักแรม, โฮสเทล, รีสอร์ต",駅に宿があります。,มีที่พักใกล้สถานีรถไฟ
雇う,やとう,"to employ, to hire",JLPT Intermediate_Japanese JLPT_3 JLPT_2 Intermediate_Japanese_Ln.8,fsV)jU5lVf,"จ้างงาน, ว่าจ้าง, รับคน, รับเข้าทำงาน",新しい人を雇います。,จ้างคนใหม่
屋根,やね,roof,JLPT JLPT_2 JLPT_3,K@]5qy=.%v,"หลังคา, หลังคาบ้าน, ฝาหลังคา, มุงหลังคา",屋根の上で猫が寝ています。,แมวนอนอยู่บนหลังคา
破る,やぶる,to tear; to violate; to defeat,JLPT JLPT_2 JLPT_3,Hc|1rO==::,"ฉีก; ละเมิด; เอาชนะ, ทำลาย, แหกกฎ, พิชิต",紙を破らないでください。,กรุณาอย่าฉีกกระดาษ
破れる,やぶれる,"to get torn, to wear out",JLPT JLPT_2 JLPT_3,Q>N&s5^Kb%,"ฉีกขาด, สึกหรอ, ขาดวิ่น, ผุพัง",ズボンが破れました。,กางเกงขาด
辞める,やめる,to retire,JLPT JLPT_2 JLPT_3,J|2c^zFs0y,"เพื่อเกษียณอายุ, ปลดเกษียณ, เลิกทำงาน, วางมือ",来年、会社を辞めます。,จะลาออกจากบริษัทปีหน้า
やや,やや,"a little, partially, somewhat",JLPT JLPT_2 JLPT_3,OikgR+nKY0,"เล็กน้อย บางส่วน บ้าง, นิดหน่อย, ส่วนหนึ่ง, พอสมควร",やや暑いです。,ค่อนข้างร้อน
唯一,ゆいいつ,"only, sole, unique",JLPT JLPT_2 JLPT_3,mNuH=kxM-E,"หนึ่งเดียว หนึ่งเดียว ไม่เหมือนใคร, เพียงหนึ่ง, เฉพาะหนึ่ง, มีเพียง",これは唯一のチャンスです。,นี่เป็นโอกาสเดียว
勇気,ゆうき,"courage, bravery, boldness",JLPT JLPT_2 JLPT_3,z0tdm#]12w,"ความกล้าหาญ ความองอาจ ความเด็ดเดี่ยว, ความหาญกล้า, ความห้าวหาญ, ความมุ่งมั่น",勇気を出して話しました。,พูดออกไปอย่างกล้าหาญ
友好,ゆうこう,friendship,JLPT JLPT_2 JLPT_3,qSk@+t:._p,"มิตรภาพ, ความเป็นเพื่อน, สัมพันธภาพ, ความผูกพัน",友好関係を深める。,กระชับความสัมพันธ์ฉันมิตร
有効,ゆうこう,"valid, effectual",JLPT Intermediate_Japanese JLPT_3 JLPT_2 Intermediate_Japanese_Ln.10,iL.?i)%fKm,"ถูกต้อง มีประสิทธิภาพ, ใช้ได้, บังเกิดผล, เป็นผล",この薬は有効ですか。,ยานี้มีประสิทธิภาพหรือไม่
優秀,ゆうしゅう,"superiority, excellence",JLPT JLPT_2 JLPT_3,O^v!ja{$6},"ความเหนือกว่า ความเป็นเลิศ, ความดีเยี่ยม, ความโดดเด่น, ความพิเศษ",彼は優秀な学生です。,เขาเป็นนักเรียนที่ยอดเยี่ยม
優勝,ゆうしょう,"overall victory, championship",JLPT Intermediate_Japanese JLPT_3 JLPT_2 Intermediate_Japanese_Ln.7,Gxir)F$3h;,"ชัยชนะโดยรวม, แชมป์, แชมป์เปี้ยน, ผู้ชนะเลิศ",優勝おめでとうございます！,ขอแสดงความยินดีที่ชนะเลิศ!
友情,ゆうじょう,"friendship, fellowship",JLPT JLPT_2 JLPT_3,hpnSza2$^g,"มิตรภาพ ความสนิทสนม, ความเป็นกันเอง, ความคุ้นเคย, ความสนิท",友情を大切にします。,ให้ความสำคัญกับมิตรภาพ
友人,ゆうじん,friend (formal),JLPT Intermediate_Japanese JLPT_3 JLPT_2 Intermediate_Japanese_Ln.15 Intermediate_Japanese_Ln.2,iE%IT=Qp]>,"เพื่อน (แบบทางการ), สหาย, มิตรสหาย, เพื่อนพ้อง",彼は私の友人です。,เขาเป็นเพื่อนของฉัน
有能,ゆうのう,"able, capable, efficient",JLPT JLPT_2 JLPT_3,P0&QeU;_J8,"มีความสามารถ มีประสิทธิภาพ, เก่งกาจ, มีฝีมือ, เป็นเลิศ",有能な人材を求めている。,กำลังมองหาบุคลากรที่มีความสามารถ
郵便,ゆうびん,"mail, postal service",JLPT JLPT_2 JLPT_3,y1Pm-8jy]k,"จดหมาย บริการไปรษณีย์, ไปรษณีย์, ไปรษณียภัณฑ์, ส่งจดหมาย",郵便局はどこですか。,ที่ทำการไปรษณีย์อยู่ที่ไหน
ユーモア,ユーモア,humor,JLPT JLPT_2 JLPT_3,df%[k|%u*+,"อารมณ์ขัน, มุกตลก, เรื่องตลก, ความขบขัน",彼のユーモアは面白い。,อารมณ์ขันของเขาตลก
有利,ゆうり,"advantageous, better",JLPT JLPT_2 JLPT_3,H]2^aHqq32,"ได้เปรียบ ดีกว่า, เป็นต่อ, ได้ผลดี, เหนือกว่า",この取引は有利です。,การทำธุรกรรมนี้ได้เปรียบ
床,ゆか,floor,JLPT JLPT_2 JLPT_3,lG~]%rmVy|,"พื้น, พื้นห้อง, พื้นบ้าน, ปูพื้น",床に座ります。,นั่งบนพื้น
愉快,ゆかい,"pleasant, happy",JLPT JLPT_2 JLPT_3,"o,+Kowdko`","น่าพึงพอใจ มีความสุข, น่ายินดี, สุขใจ, เบิกบาน",愉快な時間を過ごしました。,ใช้เวลาอย่างมีความสุข
譲る,ゆずる,"to turn over, to assign, to hand over",JLPT JLPT_2 JLPT_3,Hvg@/iJB}O,"ส่งมอบ มอบหมาย โอนย้าย, ส่งต่อ, โอนให้, ยกให้",席を譲ります。,ให้ที่นั่ง
豊か,ゆたか,"abundant, wealthy, plentiful, rich",JLPT JLPT_2 JLPT_3,"d9lbZ0yM,{","อุดมสมบูรณ์ มั่งคั่ง มากมาย มั่งคั่ง, บริบูรณ์, ร่ำรวย, เพียบพร้อม",豊かな自然。,ธรรมชาติที่อุดมสมบูรณ์
茹でる,ゆでる,to boil,JLPT JLPT_2 JLPT_3,vocx6RiGG7,"ต้ม, เดือด, ต้มน้ำ, ลวก",卵を茹でます。,ต้มไข่
許す,ゆるす,"to permit, to allow, to approve",JLPT Intermediate_Japanese JLPT_3 JLPT_2 Intermediate_Japanese_Ln.8,jUZ.+k2dQs,"อนุญาต, ยินยอม, อนุมัติ, ยอมรับ",彼女は私を許してくれました。,เธอให้อภัยฉันแล้ว
夜,よ,"evening, night",JLPT JLPT_2 JLPT_3,O|UO#;VR|i,"ตอนเย็น กลางคืน, เวลาเย็น, ค่ำคืน, ราตรี",夜は寒いです。,ตอนกลางคืนหนาว
夜明け,よあけ,"dawn, daybreak",JLPT JLPT_2 JLPT_3,P]gvvnr3UX,"รุ่งอรุณ, แสงอรุณ, อรุณรุ่ง, เช้าตรู่",夜明け前に出発します。,ออกเดินทางก่อนรุ่งสาง
酔う,よう,to get drunk,JLPT JLPT_2 JLPT_3,Nw#Iv9NMME,"ดื่มจนเมา, เมามาย, ดื่มเหล้า, มึนเมา",お酒を飲んで酔いました。,ดื่มเหล้าจนเมา
容易,ようい,"easy, simple, plain",JLPT JLPT_2 JLPT_3,P+bB1Di`Ky,"ง่าย เรียบง่าย ตรงไปตรงมา, สะดวก, ไม่ซับซ้อน, เข้าใจง่าย",これは容易な問題です。,นี่เป็นปัญหาที่ง่าย
容器,ようき,"container, vessel",JLPT JLPT_2 JLPT_3,iaea{|Cg@:,"ภาชนะ, เรือ, ถ้วยชาม, เครื่องใช้",この容器は大きいです。,ภาชนะนี้ใหญ่
陽気,ようき,"season, weather, cheerfulness",JLPT JLPT_2 JLPT_3,u51di;kV4W,"ฤดูกาล สภาพอากาศ ความร่าเริง, ช่วงเวลา, บรรยากาศ, ความสนุกสนาน",陽気な天気。,อากาศสดใส
要求,ようきゅう,"request, demand",JLPT JLPT_2 JLPT_3,nvC?4QsNf},"คำขอ, ความต้องการ, ข้อเรียกร้อง, ความประสงค์",新しい要求。,ความต้องการใหม่
用心,ようじん,"care, precaution, caution",JLPT JLPT_2 JLPT_3,Flc5De-&7.,"ความระมัดระวัง, การระมัดระวัง, ความรอบคอบ, ความไม่ประมาท",用心してください。,โปรดระวัง
様子,ようす,"aspect, state, appearance",JLPT JLPT_2 JLPT_3,A7/`ZQ{`>8,"ลักษณะ, สถานะ, รูปลักษณ์, สภาพการณ์",様子がおかしい。,ดูท่าทางผิดปกติ
要するに,ようするに,"in a word, after all, in short …",JLPT JLPT_2 JLPT_3,FOjPBhXtfP,"กล่าวโดยสรุปแล้ว..., สรุปคือ, โดยสรุป, ท้ายที่สุดแล้ว",要するに、彼は反対です。,สรุปคือ เขาไม่เห็นด้วย
要素,ようそ,element,JLPT JLPT_2 JLPT_3,GZk%&=rm6%,"องค์ประกอบ, ส่วนประกอบ, ปัจจัย, ธาตุ",成功の要素。,องค์ประกอบของความสำเร็จ
要点,ようてん,"gist, main point",JLPT JLPT_2 JLPT_3,Qs5wBsMZ.},"ใจความสำคัญ, ประเด็นหลัก, สาระสำคัญ, จุดสำคัญ",要点をまとめてください。,สรุปประเด็นสำคัญ
曜日,ようび,day of the week,JLPT JLPT_2 JLPT_3,H-|U<zuUTq,"วันในสัปดาห์, วันเวลา, วันหยุดสุดสัปดาห์, วันหยุดราชการ",今日は何曜日ですか。,วันนี้วันอะไร
ヨーロッパ,ヨーロッパ,Europe,JLPT JLPT_2 JLPT_3,cEJaT(aXg,"ยุโรป, ทวีปยุโรป, ชาวยุโรป, ประเทศยุโรป",ヨーロッパに行きたいです。,อยากไปยุโรป
予期,よき,"expectation, forecast",JLPT JLPT_2 JLPT_3,k(Z/4d8ciX,"ความคาดหวัง การพยากรณ์, ความหวัง, การคาดคะเน, การทำนาย",予期せぬ出来事。,เหตุการณ์ที่ไม่คาดคิด
横切る,よこぎる,"to cross (e.g., arms), to traverse",JLPT JLPT_2 JLPT_3,ba+_Ekz}4>,"ข้าม (เช่น แขน) ข้ามผ่าน, ผ่านข้าม, ก้าวข้าม, เดินข้าม",道を横切る。,ข้ามถนน
汚す,よごす,"to pollute, to make dirty",JLPT JLPT_2 JLPT_3,gASRu}ar&],"ทำให้เป็นมลพิษ ทำให้สกปรก, สร้างมลภาวะ, แปดเปื้อน, เลอะเทอะ",手を汚す。,ทำให้มือสกปรก
予算,よさん,"estimate, budget",JLPT JLPT_2 JLPT_3,k15uOKT$nk,"ประมาณการ งบประมาณ, การประมาณ, งบประมาณรายจ่าย, ค่าใช้จ่าย",予算が足りない。,งบประมาณไม่พอ
止す,よす,"to cease, to give up",JLPT JLPT_2 JLPT_3,g87)Rqp|@G,"เลิก, ยอมแพ้, หยุด, ล้มเลิก",その話はもう止す。,เลิกพูดเรื่องนั้นได้แล้ว
寄せる,よせる,"to collect, to gather, to put aside",JLPT JLPT_2 JLPT_3,M9{&7Gc5&~,"รวบรวม, เก็บสะสม, กันไว้, สะสม",ゴミを寄せる。,รวบรวมขยะ
予測,よそく,"prediction, estimation",JLPT JLPT_2 JLPT_3,E(^1aDIi!6,"การทำนาย การประมาณค่า, การพยากรณ์, การคาดการณ์, การคาดคะเน",将来を予測する。,คาดการณ์อนาคต
ヨット,ヨット,yacht,JLPT JLPT_2 JLPT_3,G/C^ah63g_,"ยอชต์, เรือยอชต์, เรือสำราญ, เรือใบ",ヨットに乗る。,ขึ้นเรือยอชต์
夜中,よなか,"midnight, dead of night",JLPT JLPT_2 JLPT_3,QTA:28I)zV,"เที่ยงคืน กลางดึก, ดึกสงัด, ยามวิกาล, เวลากลางคืน",夜中に目が覚めた。,ตื่นตอนกลางดึก
世の中,よのなか,"society, the world",JLPT Intermediate_Japanese JLPT_3 JLPT_2 Intermediate_Japanese_Ln.14,zQaur22G#@,"สังคม โลก, ประชาคม, โลกมนุษย์, สากลโลก",世の中は広い。,โลกนี้กว้างใหญ่
余分,よぶん,"extra, excess, surplus",JLPT JLPT_2 JLPT_3,uLcn4c5r}h,"ส่วนเกิน, มากเกิน, เหลือเฟือ, ส่วนที่เหลือ",余分なものはありません。,ไม่มีอะไรเกินมา
予報,よほう,"forecast, prediction",JLPT JLPT_2 JLPT_3,CpZ2Kf3K1p,"การพยากรณ์ การคาดการณ์, การทำนาย, การคาดคะเน, การคาดหมาย",天気予報を見る。,ดูพยากรณ์อากาศ
予防,よぼう,"prevention, protection against",JLPT JLPT_2 JLPT_3,rDZhF+<_&},"การป้องกัน การคุ้มครองจาก, การสกัดกั้น, การปกป้อง, การคุ้มกัน",病気の予防。,การป้องกันโรค
