オフィス,オフィス,office,JLPT JLPT_2 JLPT_3,t+v1qGjm`2,"สำนักงาน, ที่ทำการ, ออฟฟิศ, แผนก",会社は新しいオフィスに移った。,บริษัทได้ย้ายไปยังออฟฟิศแห่งใหม่
溺れる,おぼれる,"to be drowned, to indulge in",JLPT JLPT_2 JLPT_3,L6mI#frmDD,"จมน้ำ, ปล่อยตัวตามใจ, จมดิ่ง, ลุ่มหลง",彼は仕事に溺れている。,เขาทุ่มเทให้กับงานมากเกินไป
お前,おまえ,"you (sing), presence (of a high personage)",JLPT JLPT_2 JLPT_3,kiGe-uw>iW,"คุณ (ร้องเพลง) การปรากฏตัว (ของบุคคลสำคัญ), แก, มึง, เอ็ง",お前は大丈夫か。,แกโอเคไหม
おめでとう,おめでとう,"Congratulations!, an auspicious occasion!",JLPT JLPT_2 JLPT_3,IjwH:94kN^,"ขอแสดงความยินดีด้วย! เนื่องในโอกาสอันเป็นมงคล!, ยินดีด้วย, ดีใจด้วย, ในโอกาสอันดี",お誕生日おめでとうございます！,สุขสันต์วันเกิด!
お目に掛かる,おめにかかる,"meet ~, see ~",JLPT JLPT_2 JLPT_3,O[qSUns&-f,"พบปะ ~, ดู ~, พบเจอ, เข้าพบ",明日、先生にお目に掛かります。,พรุ่งนี้จะไปพบอาจารย์
思い付く,おもいつく,"to think of, to hit upon",JLPT JLPT_2 JLPT_3,phC=E!Uzsp,"คิดออก, นึกออก, นึกขึ้นได้, คิดค้น",急にいい考えが思い付いた。,จู่ๆ ก็นึกไอเดียดีๆ ออกมาได้
思い出,おもいで,"memories, recollections, reminiscence",JLPT JLPT_3 JLPT_2 Genki_Ln.23 Genki,C>r<Y|QfhA,"ความทรงจำ, ความนึกย้อน, การรำลึก, ความหลัง",子供の頃の思い出を話した。,เล่าความทรงจำสมัยเด็ก
主に,おもに,"mainly, primarily",JLPT JLPT_2 JLPT_3,KJv^Ck6t)-,"โดยส่วนใหญ่ เป็นหลัก, ส่วนใหญ่, เป็นสำคัญ, เป็นส่วนใหญ่",主に休日に友達と会う。,ส่วนใหญ่จะเจอเพื่อนในวันหยุด
思わず,おもわず,"unintentional, spontaneous",JLPT JLPT_2 JLPT_3,mqEM$vUJ]Z,"ไม่ได้ตั้งใจ เกิดขึ้นเองโดยธรรมชาติ, โดยไม่ตั้งใจ, โดยไม่เจตนา, พลั้งเผลอ",あまりの可愛さに思わず笑ってしまった。,น่ารักมากจนเผลอยิ้มออกมา
泳ぎ,およぎ,swimming,JLPT JLPT_2 JLPT_3,p%YEcD<#qK,"การว่ายน้ำ, การดำน้ำ, การลอยตัว, การแหวกว่าย",川で泳ぎたいです。,อยากจะว่ายน้ำในแม่น้ำ
およそ,およそ,"about, roughly, approximately",JLPT JLPT_2 JLPT_3,cmb!OC{1dV,"ประมาณ, โดยประมาณ, ราวๆ",およそ５００円です。,ประมาณ 500 เยนครับ
及ぼす,およぼす,"to exert, to cause, to exercise",JLPT JLPT_2 JLPT_3,lC%7ty:^eB,"ออกแรง, ทำให้เกิดขึ้น, ออกกำลังกาย, ก่อให้เกิด",そのニュースは社会に大きな影響を及ぼした。,ข่าวสารนั้นส่งผลกระทบอย่างใหญ่หลวงต่อสังคม
下す,おろす,"to lower, to let go down",JLPT JLPT_2 JLPT_3,JRZI*AHd)D,"ลดลง, ปล่อยลง, เอาลง, วางลง",箱から本を下ろす。,นำหนังสือออกจากกล่อง
降ろす,おろす,"to take down, to launch, to drop",JLPT JLPT_2 JLPT_3,PQD_mXy>W.,"เพื่อทำลาย เพื่อปล่อย เพื่อทิ้ง, ปล่อยลง, หย่อนลง, เอาออก",子供を車から降ろす。,พาเด็กออกจากรถ
卸す,おろす,"to sell wholesale, grated (vegetables)",JLPT JLPT_2 JLPT_3,GT*kAh$cd0,"ขายส่งผักขูด, ขายเหมา, ขูด, บด",農家が野菜を卸す。,ชาวนาขายส่งผัก
音,おん,"sound, note",JLPT JLPT_2 JLPT_3,gkN]*wY]?s,"เสียง, โน้ต, สำเนียง, เสียงดนตรี",鳥の音が聞こえる。,ได้ยินเสียงนก
恩,おん,"favor, obligation, debt of gratitude",JLPT JLPT_2 JLPT_3,"A4Iq0-B@,;","ความช่วยเหลือ, ภาระผูกพัน, หนี้บุญคุณ, บุญคุณ",先生の恩に感謝します。,ขอบคุณในความเมตตาของอาจารย์
温暖,おんだん,warmth,JLPT JLPT_2 JLPT_3,N&n<_QP1.Q,"ความอบอุ่น, อุณหภูมิอบอุ่น, ความอุ่น, ความสบาย",温暖な気候で過ごしやすい。,อากาศอบอุ่นอยู่สบาย
温度,おんど,temperature,JLPT JLPT_2 JLPT_3,NA1Ge#l-~k,"อุณหภูมิ, ระดับความร้อน, ความร้อน, ความเย็น",今日の気温は２５度です。,อุณหภูมิวันนี้ 25 องศา
可,か,passable,JLPT JLPT_2 JLPT_3,l:l&EInHym,"พอผ่านได้, พอใช้ได้, ยอมรับได้, ผ่านเกณฑ์",このレポートは可だ。,รายงานนี้พอใช้ได้
蚊,か,mosquito,JLPT JLPT_3 JLPT_2 Genki Genki_Ln.21,j=4=()Uwi2,"ยุง, แมลงดูดเลือด, แมลงกัด, ตัวดูดเลือด",蚊に刺された。,ถูกยุงกัด
課,か,"department, division",JLPT JLPT_2 JLPT_3,QQ1!.:!+a[,"แผนก, ฝ่าย, ส่วนงาน, หน่วยงาน",経理課の山田さん。,คุณยามาดะจากแผนกบัญชี
カー,カー,car,JLPT JLPT_2 JLPT_3,o!p+_Rb<h*,"รถ, ยานยนต์, รถยนต์, พาหนะ",車で駅まで行った。,ไปสถานีรถไฟด้วยรถยนต์
カード,カード,"card, curd",JLPT JLPT_2 JLPT_3,"F,Np^@m5hi","การ์ด, เคิร์ด, บัตร, แผ่นบัตร",ポイントカードをください。,ขอการ์ดสะสมแต้มครับ
貝,かい,"shell, shellfish",JLPT JLPT_2 JLPT_3,HNd6/BU{>X,"เปลือกหอย, สัตว์ทะเลมีเปลือก, หอย, หอยทะเล",貝殻がたくさん落ちていた。,มีเปลือกหอยตกอยู่มากมาย
害,がい,"harm, damage",JLPT JLPT_2 JLPT_3,g|Fzqe^$7$,"อันตราย, ความเสียหาย, ภัยอันตราย, โทษ",この薬は体に害がある。,ยานี้มีอันตรายต่อร่างกาย
会員,かいいん,"member, the membership",JLPT JLPT_2 JLPT_3,li]JQ4<Kd[,"สมาชิก, การเป็นสมาชิก, ผู้ร่วม, ผู้เป็นสมาชิก",会員になりたいです。,อยากจะเป็นสมาชิก
絵画,かいが,"picture, painting",JLPT JLPT_2 JLPT_3,emKUHOyrV`,"ภาพวาด, ภาพเขียน, รูปวาด, รูปภาพ",美術館で絵画を見た。,ชมภาพวาดที่พิพิธภัณฑ์ศิลปะ
海外,かいがい,"foreign, abroad, overseas",JLPT JLPT_2 JLPT_3,qq4=IgxkU<,"ต่างประเทศ, ต่างแดน, โพ้นทะเล",海外旅行に行きたい。,อยากไปเที่ยวต่างประเทศ
会計,かいけい,"account, finance",JLPT JLPT_2 JLPT_3,bX?OL%f/L+,"บัญชี การเงิน, การเงิน, บัญชีทรัพย์สิน, บันทึกการเงิน",会計をお願いします。,ขอคิดเงินด้วยครับ
解決,かいけつ,"settlement, solution, resolution",JLPT JLPT_2 JLPT_3,rmn(v?B?3g,"การประนีประนอม การแก้ปัญหา การยุติ, การแก้ไข, การคลี่คลาย, การตัดสินใจ",問題を解決する。,แก้ไขปัญหา
会合,かいごう,"meeting, assembly",JLPT JLPT_2 JLPT_3,f9BQ|i/j|},"การประชุม, การชุมนุม, การพบปะ, การรวมตัว",会議の会合が開かれた。,มีการจัดประชุม
外交,がいこう,diplomacy,JLPT JLPT_2 JLPT_3,A]90<@ohwE,"การทูต, การต่างประเทศ, ความสัมพันธ์ระหว่างประเทศ, กิจการต่างประเทศ",外交官になるのが夢です。,ความฝันคือการเป็นนักการทูต
開始,かいし,"start, commencement, beginning",JLPT JLPT_2 JLPT_3,qgkolirBJK,"เริ่ม, การเริ่มต้น, จุดเริ่มต้น, การริเริ่ม",新しいプロジェクトを開始します。,เริ่มโครงการใหม่
解釈,かいしゃく,"explanation, interpretation",JLPT JLPT_2 JLPT_3,Ih/AkEg/|E,"คำอธิบาย การตีความ, การอธิบาย, การแปลความ, การชี้แจง",彼の言葉を誤解した。,ตีความคำพูดของเขาผิดไป
外出,がいしゅつ,"outing, going out",JLPT JLPT_2 JLPT_3,Ol@%UFQ/rD,"ออกไปข้างนอก, การออกไปข้างนอก, การออกจากบ้าน",今日は外出します。,วันนี้จะออกไปข้างนอก
改善,かいぜん,"betterment, improvement",JLPT JLPT_2 JLPT_3,fv+>GYURp:,"การพัฒนาให้ดีขึ้น, การปรับปรุง, การพัฒนา, การทำให้ดีขึ้น",生活を改善したい。,อยากปรับปรุงชีวิตให้ดีขึ้น
快適,かいてき,"pleasant, agreeable",JLPT JLPT_2 JLPT_3,Bh^`k;OTy|,"น่าพอใจ, สบายใจ, น่าสบาย, ผ่อนคลาย",快適な部屋です。,เป็นห้องที่สบาย
回復,かいふく,"recovery (from illness), rehabilitation, restoration",JLPT JLPT_2 JLPT_3,wc6OB#:n9.,"การฟื้นตัว (จากความเจ็บป่วย), การฟื้นฟู, การคืนสภาพ, การฟื้นคืน",病気が回復した。,หายจากอาการป่วยแล้ว
飼う,かう,to keep; to own (a pet); to raise; to feed,JLPT Genki_Ln.11 JLPT_3 JLPT_2 Genki,wfURRt4tC[,"เก็บไว้; เป็นเจ้าของ (สัตว์เลี้ยง); เลี้ยงดู; ให้อาหาร, เลี้ยงสัตว์, เลี้ยงดู, ให้อาหารสัตว์",猫を飼っています。,เลี้ยงแมวอยู่
帰す,かえす,to send back,JLPT JLPT_2 JLPT_3,LZ<.!]FC|8,"เพื่อส่งคืน, คืน, กลับคืน, ส่งกลับ",本を元の場所へ返す。,คืนหนังสือไปยังที่เดิม
代える,かえる,"to exchange, to interchange, to substitute",JLPT JLPT_2 JLPT_3,Ccj6!`~jPu,"แลกเปลี่ยน, สลับเปลี่ยน, ทดแทน, แทนที่",彼と友達を代える。,เปลี่ยนเพื่อนของเขา
替える,かえる,"to exchange, to interchange, to substitute",JLPT JLPT_2 JLPT_3,"Fv2F,v+u]8","แลกเปลี่ยน, สลับเปลี่ยน, ทดแทน, เปลี่ยนแปลง",この服を新しいのと替えます。,จะเปลี่ยนเสื้อตัวนี้กับตัวใหม่
換える,かえる,"to exchange, to interchange, to substitute",JLPT JLPT_3 JLPT_2 Genki_Ln.23 Genki,mmtj;wD(Zd,"แลกเปลี่ยน, สลับเปลี่ยน, ทดแทน",お金を円に換える。,แลกเงินเป็นเยน
反る,かえる,"to warp, to be warped, to curve",JLPT JLPT_2 JLPT_3,"vDLMxa,sN/","บิดเบี้ยว, ถูกบิดเบี้ยว, โค้งงอ, งอตัว",紙が反っている。,กระดาษกำลังบิดเบี้ยว
香り,かおり,"aroma, fragrance",JLPT JLPT_2 JLPT_3,me}_g<26n*,"กลิ่นหอม, น้ำหอม, ความหอม, กลิ่นอาย",花の香りがする。,มีกลิ่นหอมของดอกไม้
画家,がか,painter,JLPT JLPT_2 JLPT_3,Pl:-st.KZ+,"จิตรกร, ช่างเขียน, ศิลปินวาดภาพ, ผู้วาด",有名な画家です。,เป็นจิตรกรที่มีชื่อเสียง
抱える,かかえる,to hold or carry under or in the arms,JLPT JLPT_2 JLPT_3,"PQR[r=WB$,","ถือหรืออุ้มไว้ใต้หรือในอ้อมแขน, โอบ, แบกรับ, ถือไว้",子供を抱える。,อุ้มเด็ก
価格,かかく,"price, value",JLPT JLPT_2 JLPT_3,xFP@p4LxH5,"ราคา, มูลค่า, ราคาขาย, ค่า",この商品の価格はいくらですか。,ราคาสินค้านี้เท่าไหร่ครับ
化学,かがく,chemistry,JLPT JLPT_2 JLPT_3,Sh/.K7MGJ,"เคมี, วิชาเคมี, เคมีภัณฑ์, วิทยาศาสตร์เคมี",化学の実験をする。,ทำการทดลองเคมี
輝く,かがやく,"to shine, to glitter, to sparkle",JLPT JLPT_2 JLPT_3,Dzyp)tD%e,"ส่องแสง, ระยิบระยับ, เปล่งประกาย, เจิดจ้า",星が輝いている。,ดวงดาวกำลังส่องแสง
係,かかり,person in charge,JLPT JLPT_2 JLPT_3,Q&QZSK._J<,"ผู้รับผิดชอบ, เจ้าหน้าที่, ผู้ดูแล, ผู้รับผิดชอบงาน",この件は私が係です。,เรื่องนี้ผมเป็นผู้รับผิดชอบ
罹る,かかる,to suffer from,JLPT JLPT_2 JLPT_3,h_Phc0xEm%,"ทนทุกข์ทรมานจาก, เจ็บป่วย, ประสบ, ติดเชื้อ",風邪を罹った。,เป็นหวัด
限る,かぎる,"to restrict, to limit, to confine",JLPT JLPT_2 JLPT_3,Ku)jdi.uTn,"จำกัด, ควบคุม, กักขัง, บังคับ",日曜日は店を限る。,ร้านปิดในวันอาทิตย์
掻く,かく,to scratch,JLPT JLPT_2 JLPT_3,K):N$B19m+,"เพื่อขูดขีด, เกา, ขูด, ครูด",虫に掻かれた。,ถูกแมลงกัด
描く,かく,"to draw, to depict, to describe",JLPT JLPT_2 JLPT_3,grO;5{y}I|,"วาด, พรรณนา, อธิบาย, ร่างภาพ",美しい景色を描く。,วาดภาพทิวทัศน์ที่สวยงาม
嗅ぐ,かぐ,"to sniff, to smell",JLPT JLPT_2 JLPT_3,vaKqc&PyP9,"ดมกลิ่น, สูดดม, ได้กลิ่น, ลองดม",花の香りを嗅ぐ。,ดมกลิ่นหอมของดอกไม้
家具,かぐ,furniture,Genki_Ln.15 JLPT JLPT_3 JLPT_2 Genki,gqN}MYosw6,"เฟอร์นิเจอร์, เครื่องเรือน, เครื่องตกแต่งบ้าน, ของใช้ในบ้าน",新しい家具を買った。,ซื้อเฟอร์นิเจอร์ใหม่
学,がく,"learning, knowledge",JLPT JLPT_2 JLPT_3,w:XhV>-rir,"การเรียนรู้ ความรู้, วิทยา, ศึกษา, ภูมิรู้",学は一生のものだ。,การเรียนรู้คือสิ่งที่จะติดตัวไปตลอดชีวิต
額,がく,amount; frame,JLPT JLPT_2 JLPT_3,iG]&$wbDKv,"จำนวน; กรอบ, ปริมาณ, ยอดเงิน, กรอบรูป",額に汗をかく。,เหงื่อออกที่หน้าผาก
覚悟,かくご,"resolution, resignation, readiness",JLPT JLPT_2 JLPT_3,j/*:m6x0J),"มติ การลาออก ความพร้อม, การเตรียมใจ, ความพร้อม, การตัดสินใจ",覚悟して戦った。,ต่อสู้ด้วยความตั้งใจ
確実,かくじつ,"certainty, reliability, soundness",JLPT JLPT_2 JLPT_3,Nzie2SM<&O,"ความแน่นอน ความน่าเชื่อถือ ความมั่นคง, แน่นอน, เชื่อถือได้, มั่นคง",確実な証拠がある。,มีหลักฐานที่แน่ชัด
学者,がくしゃ,scholar,JLPT JLPT_2 JLPT_3,RamhNRc=y:,"นักวิชาการ, ปัญญาชน, ผู้รู้, ผู้คงแก่เรียน",彼は有名な学者だ。,เขาเป็นนักวิชาการที่มีชื่อเสียง
学習,がくしゅう,"study, learning",JLPT JLPT_2 JLPT_3,PHg7|5Zlfd,"การศึกษา การเรียนรู้, การเรียน, การศึกษาเล่าเรียน, การอบรม",日本語を学習している。,กำลังเรียนภาษาญี่ปุ่น
隠す,かくす,"to hide, to conceal",JLPT JLPT_2 JLPT_3,vMufH!:aAV,"ซ่อน, ปกปิด, เก็บซ่อน, แอบซ่อน",秘密を隠す。,ซ่อนความลับ
拡大,かくだい,"magnification, enlargement",JLPT JLPT_2 JLPT_3,f7kQq91Ua<,"การขยายภาพ, การซูมเข้า, การขยายใหญ่, การเพิ่มขนาด",写真の拡大を見せる。,แสดงภาพถ่ายที่ขยายใหญ่
確認,かくにん,"affirmation, confirmation",JLPT JLPT_2 JLPT_3,kk{ITQ}D*5,"การยืนยัน, การอนุมัติ, การรับรอง, การตรวจสอบ",予約を確認する。,ยืนยันการจอง
学問,がくもん,"scholarship, study, learning",JLPT JLPT_2 JLPT_3,Jk{+Uk9@=d,"ทุนการศึกษา การศึกษา การเรียนรู้, วิชาการ, วิทยาการ, การค้นคว้า",学問は大切だ。,วิชาการเป็นสิ่งสำคัญ
隠れる,かくれる,"to hide, to be hidden",JLPT JLPT_2 JLPT_3,Iv9k~&!9Sa,"ซ่อนตัว, ถูกซ่อนไว้, หลบซ่อน, แอบอยู่",子供が箱の中に隠れる。,เด็กซ่อนตัวอยู่ในกล่อง
影,かげ,"shade, shadow, other side",JLPT JLPT_2 JLPT_3,e~q8TnSV#A,"เงา, อีกด้านหนึ่ง, ร่มเงา",木に影ができる。,เกิดเงาใต้ต้นไม้
陰,かげ,"shade, shadow, other side",JLPT JLPT_2 JLPT_3,JZ1GmL8t.y,"เงา, อีกด้านหนึ่ง, ด้านมืด",暗い陰がある。,มีความมืดมิดที่ซ่อนอยู่
欠ける,かける,to be lacking,JLPT JLPT_2 JLPT_3,c*r`UH]nG8,"ขาดแคลน, พร่อง, ไม่ครบ, บกพร่อง",部品が欠けている。,ชิ้นส่วนขาดหายไป
加減,かげん,adjustment; addition and subtraction,JLPT JLPT_2 JLPT_3,h.?lP}8!)~,"การปรับค่า; การบวกและการลบ, การปรับปรุง, การควบคุม, การลดหย่อน",温度の加減をしてください。,กรุณาปรับอุณหภูมิ
過去,かこ,past,JLPT Intermediate_Japanese JLPT_3 JLPT_2 Intermediate_Japanese_Ln.13,"dbDE7?,;2l","อดีต, เรื่องราวในอดีต, อดีตกาล, ครั้งก่อน",過去の出来事を思い出す。,นึกถึงเหตุการณ์ในอดีต
籠,かご,"basket, cage",JLPT JLPT_2 JLPT_3,nt-Kbv73>],"ตะกร้า, กรง, กระเช้า, ตะกร้าสาน",果物を籠に入れる。,ใส่ผลไม้ลงในตะกร้า
囲む,かこむ,"to surround, to encircle",JLPT JLPT_2 JLPT_3,"AC8Gt39]%,","ล้อมรอบ, โอบล้อม, ล้อมวง",友達が私を囲む。,เพื่อนๆ ล้อมรอบฉัน
火災,かさい,"conflagration, fire",JLPT JLPT_2 JLPT_3,C?jW[uV]~u,"เพลิงไหม้, ไฟไหม้, อัคคีภัย, เปลวเพลิง",火災が発生した。,เกิดเพลิงไหม้
重なる,かさなる,"to be piled up, lie on top of one another",JLPT JLPT_2 JLPT_3,qEGvs]3ApH,"กองทับกัน นอนทับกัน, ซ้อนกัน, วางซ้อน, เกยกัน",書類が重なっている。,เอกสารซ้อนกันอยู่
重ねる,かさねる,"to pile up, to put something on another, to heap up",JLPT JLPT_2 JLPT_3,i%7_$Pa~m],"กองซ้อนกัน, วางสิ่งหนึ่งทับอีกสิ่งหนึ่ง, สะสม, ทับกัน",本を何冊も重ねる。,วางหนังสือซ้อนกันหลายเล่ม
飾り,かざり,decoration,JLPT JLPT_2 JLPT_3,b$htguAWNP,"การตกแต่ง, เครื่องประดับ, ของประดับ, ประดับประดา",部屋に飾りを付ける。,ติดของตกแต่งในห้อง
貸し,かし,"loan, lending",JLPT JLPT_2 JLPT_3,hK1t$y~&<,"เงินกู้, การให้กู้ยืม, การกู้, ให้กู้",友達に本を貸した。,ให้เพื่อนยืมหนังสือ
菓子,かし,"confectionery, sweet",JLPT JLPT_2 JLPT_3,uK+`Lg$t0E,"ขนมหวาน, ของหวาน, ขนม, ลูกอม",お茶と菓子。,ชาและขนม
家事,かじ,household matters; housework (same as 家の仕事 (いえのしごと)),JLPT Intermediate_Japanese JLPT_3 JLPT_2 Intermediate_Japanese_Ln.14 Genki_Ln.22 Genki,oS4iCB;y-f,"เรื่องในครัวเรือน งานบ้าน (เหมือนกับ 家の仕事 (いえのしごと)), กิจการบ้าน, งานเรือน, ธุระบ้าน",家事を手伝う。,ช่วยทำงานบ้าน
賢い,かしこい,"wise, clever, smart",JLPT JLPT_2 JLPT_3,rE7F6b61Rm,"ฉลาด หลักแหลม หลักแหลม, ปราดเปรื่อง, สุขุม, มีไหวพริบ",賢い子供だ。,เป็นเด็กที่ฉลาด
歌手,かしゅ,singer,JLPT Genki_Ln.11 JLPT_3 JLPT_2 Genki,NmC8EM=]mA,"นักร้อง, ผู้ขับร้อง, คนร้องเพลง, ศิลปินเพลง",彼女は有名な歌手です。,เธอเป็นนักร้องที่มีชื่อเสียง
数,かず,"number, figure, amount",JLPT Intermediate_Japanese JLPT_3 JLPT_2 Intermediate_Japanese_Ln.3,DD:chgc^KO,"ตัวเลข, จำนวน, ปริมาณ, เลข",人数を数える。,นับจำนวนคน
稼ぐ,かせぐ,"to earn income, to labor",JLPT JLPT_2 JLPT_3,rzTOas5wcB,"เพื่อหารายได้ เพื่อทำงาน, หาเงิน, ทำงานหาเลี้ยง, สร้างรายได้",一生懸命稼ぐ。,ทำงานหนักเพื่อหาเงิน
数える,かぞえる,to count,JLPT JLPT_2 JLPT_3,J-q>{61#D9,"นับ, คิดเลข, คำนวณ, ประมาณ",指で数える。,นับด้วยนิ้ว
型,かた,"mold, model, style",JLPT JLPT_2 JLPT_3,p8F!A2no<N,"แม่พิมพ์, แบบจำลอง, สไตล์, รูปแบบ",この型は人気がある。,รูปแบบนี้เป็นที่นิยม
肩,かた,shoulder,JLPT JLPT_2 JLPT_3,dyYF&B&tH[,"ไหล่, บ่า, สะบัก, หัวไหล่",肩が痛い。,ปวดไหล่
堅い,かたい,"hard, firm, solid",JLPT JLPT_2 JLPT_3,Pf^;5Zn/;l,"แข็ง แน่น มั่นคง, แกร่ง, กระด้าง, ไม่โยกคลอน",堅いパン。,ขนมปังแข็ง
硬い,かたい,"hard, firm, solid",JLPT JLPT_2 JLPT_3,"A5A<hg!,v}","แข็ง แน่น มั่นคง, ทนทาน, ไม่ยืดหยุ่น, ตึง",硬い地面。,พื้นแข็ง
